Unnamed: 0,Unnamed: 0.1,Unnamed: 1,Unnamed: 2,Unnamed: 3,Unnamed: 4
101,,,301-2,Percentage of recycled input materials used to manufacture the organization's primary products and services.,Metric not disclosed
102,,,301-3,Reclaimed products and their packaging materials.,Metric not disclosed
103,,GRI 302: Energy 2016,,,
104,,,302-1,Energy consumption within the organisation,APA FY23 Sustainability Data Book - 3. Infrastructure
105,,,302-2,Energy consumption outside of the organisation,Metric not disclosed
106,,,302-3,Energy intensity,Metric not disclosed
107,,,302-4,Reduction of energy consumption,Metric not disclosed
108,,,302-5,Reductions in energy requirements of products and services,Metric not disclosed
109,,GRI 303: Water and Effluents 2018,,,
110,,,303-1,A description of how the organisation interacts with water,Metric not disclosed
111,,,303-2,Management of water discharge-related impacts,Metric not disclosed
112,,,303-3,Water withdrawal,Metric not disclosed
113,,,303-4,Water discharge,Metric not disclosed
114,,,303-5,Water consumption,Metric not disclosed
115,,GRI 304: Biodiversity 2016,,,
116,,,304-1,"Operational sites owned, leased, managed in, or adjacent to, protected areas and areas of high biodiversity value outside protected areas",Metric not disclosed
117,,,304-2,"Significant impacts of activities, products, and services on biodiversity",Metric not disclosed
118,,,304-3,Habitats protected or restored,Metric not disclosed
119,,,304-4,IUCN Red List species and national conservation list species with habitats in areas affected by operations,Metric not disclosed
120,,GRI 305: Emissions 2016,,,
121,,,305-1,Direct (Scope 1) GHG emissions,APA FY23 Climate Data Book
122,,,305-2,Energy indirect (Scope 2) GHG emissions,APA FY23 Climate Data Book
123,,,305-3,Other indirect (Scope 3) GHG emissions,APA FY23 Climate Data Book
124,,,305-4,GHG emissions intensity,APA FY23 Climate Data Book
125,,,305-5,Reduction of GHG emissions,APA FY23 Climate Data Book
126,,,305-6,Emissions of ozone-depleting substances (ODS),Metric not disclosed
127,,,305-7,"Nitrogen oxides (NOX), sulfur oxides (SOX), and other significant air emissions",APA FY23 Sustainability Data Book - 9. Air emissions
128,,GRI 306: Waste 2020,GRI 306: Waste 2020,,
129,,,306-1,Waste generation and significant waste-related impacts,Metric not disclosed
130,,,306-2,Management of significant waste-related impacts,Metric not disclosed
131,,,306-3,Waste generated,Metric not disclosed
132,,,306-4,Waste diverted from disposal,Metric not disclosed
133,,,306-5,Waste directed to disposal,Metric not disclosed
134,,GRI 307: Environmental Compliance 2016,,,
135,,,307-1,Non-compliance with environmental laws and regulations.,Metric partially disclosed \nAPA Annual Report - Environment & Heritage\nAPA FY23 Sustainability Data Book - 8. Environment
136,,GRI 308: Supplier Environmental Assessment 2016,,,
137,,,308-1,New suppliers that were screened using environmental criteria,Metric partially disclosed - APA Modern Slavery Statement 2022
138,,,308-2,Negative environmental impacts in the supply chain and actions taken,Metric partially disclosed - APA Modern Slavery Statement 2022
139,,SOCIETY,SOCIETY,,
140,,GRI 401: Employment 2016,,,
141,,,401-1,New employee hires and employee turnover,APA FY23 Sustainability Data Book - 6. People & Culture
142,,,401-2,Benefits provided to full-time employees,APA Website â Working at APA\nhttps://www.apa.com.au/careers/working-at-apa/
143,,,401-3,Parental leave,APA FY23 Sustainability Data Book - 6. People & Culture
144,,GRI 402: Labor/Management Relations 2016,,,
145,,,402-1,Minimum notice periods regarding operational changes,Metric not disclosed
146,,GRI 403: Occupational Health and Safety 2018,,,
147,,,403-1,Occupational health and safety management system,"APA Annual Report 2023 - Health, Safety & Wellbeing\nAPA FY23 Sustainability Data Book - 7. Health & Safety"
148,,,403-2,"Hazard identification, risk assessment, and incident investigation",APA FY23 Sustainability Data Book - 7. Health & Safety
149,,,403-3,Occupational health services,"APA Annual Report 2023 - Health, Safety & Wellbeing\nAPA FY23 Sustainability Data Book - 7. Health & Safety"
150,,,403-4,"Worker participation, consultation, and communication on occupational health and safety","Health, Safety and Wellbeing Policy https://www.apa.com.au/globalassets/about-apa/our- organisation/corporate-governance/conduct-\npolicies/apa-health-safety-and-wellbeing-policy.pdf"
151,,,403-5,Worker training on occupational health and safety,"APA Annual Report 2023 - Health, Safety & Wellbeing\nAPA FY23 Sustainability Data Book - 7. Health & Safety"
152,,,403-6,Promotion of worker health,"APA Annual Report 2023 - Health, Safety & Wellbeing"
153,,,403-7,Prevention and mitigation of occupational health and safety impacts directly linked by business\nrelationships,"APA Annual Report 2023 - Health, Safety & Wellbeing"
154,,,403-8,Workers covered by an occupational health and safety management system,"APA Annual Report 2023 - Health, Safety & Wellbeing\nAPA FY23 Sustainability Data Book - 7. Health & Safety"
155,,,403-9,Work-related injuries,Metric partially disclosed - APA FY23 Sustainability Data Book - 7. Health & Safety
156,,,403-10,Work-related ill health,APA FY23 Sustainability Data Book - 7. Health & Safety
157,,GRI 404: Training and Education 2016,,,
158,,,404-1,Average hours of training per year per employee,"APA Annual Report 2023 - Health, Safety & Wellbeing\nAPA FY23 Sustainability Data Book - 7. Health & Safety"
159,,,404-2,Programs for upgrading employee skills and transition assistance programs,"APA Annual Report 2023 \n- People & culture\n- Health, Safety & Wellbeing"
160,,,404-3,Percentage of employees receiving regular performance and career development reviews,Metric not disclosed
161,,GRI 405: Diversity and Equal Opportunity 2016,,,
162,,,405-1,Diversity of governance bodies and employees,APA Annual Report - People & Culture\nAPA FY23 Sustainability Data Book - 6. People & Culture
163,,,405-2,Ratio of basic salary and remuneration of women to men,Metric not disclosed
164,,GRI 406: Non-Discrimination 2016,,,
165,,,406-1,Incidents of discrimination and corrective actions taken,APA Annual Report - People & Culture\n
166,,GRI 407: Freedom of Association and Collective Bargaining 2016,,,
167,,,407-1,Operations and suppliers in which the right to freedom of association and collective bargaining may be at risk,APA Annual Report - People & Culture\nAPA FY23 Sustainability Data Book - 6. People & Culture
168,,GRI 408: Child Labor 2016,,,
169,,,408-1,Operations and suppliers at significant risk for incidents of child labor,APA Modern Slavery Statement 2022
170,,GRI 409: Forced or Compulsory Labor 2016,,,
171,,,409-1,Operations and suppliers at significant risk for incidents of forced or compulsory labor,APA Modern Slavery Statement 2022
172,,GRI 410: Security Practices 2016,,,
173,,,410-1,Security personnel trained in human rights policies or procedures,Metric not disclosed
174,,GRI 411: Rights of Indigenous Peoples 2016,,,
175,,,411-1,Incidents of violations involving rights of Indigenous peoples,Metric not disclosed
176,,GRI 412: Human Rights Assessment 2016,,,
177,,,412-1,Operations that have been subject to human rights reviews or impact assessments,Metric not disclosed
178,,,412-2,Employee training on human rights policies or procedures,Metric not disclosed
179,,,412-3,Significant investment agreements and contracts that include human rights clauses or that underwent human rights screening,Metric not disclosed
180,,GRI 413: Local Communities 2016,,,
181,,,413-1,"Operations with local community engagement, impact assessments, and development programs",Metric not disclosed
182,,,413-2,Operations with significant actual and potential negative impacts on local communities,Metric not disclosed
183,,GRI 414: Supplier Social Assessment 2016,,,
184,,,414-1,New suppliers that were screened using social criteria,APA Modern Slavery Statement 2022
185,,,414-2,Negative social impacts in the supply chain and actions taken,APA Modern Slavery Statement 2022
186,,GRI 415: Public Policy 2016,,,
187,,,415-1,Political contributions,APA Annual Report 2023 - Governance
188,,GRI 416: Customer Health and Safety 2016,,,
189,,,416-1,Assessment of the health and safety impacts of product and service categories,Metric not disclosed - indicator immaterial to APA
190,,,416-2,Incidents of non-compliance concerning the health and safety impacts of products and services,Metric not disclosed - indicator immaterial to APA
191,,GRI 417: Marketing and Labelling 2016,,,
192,,,417-1,Requirements for product and service information and labelling,Metric not disclosed - indicator immaterial to APA
193,,,417-2,Incidents of non-compliance concerning product and service information and labelling,Metric not disclosed - indicator immaterial to APA
194,,,417-3,Incidents of non-compliance concerning marketing communications,Metric not disclosed - indicator immaterial to APA
195,,GRI 418: Customer Privacy 2016,,,
196,,,418-1,Substantiated complaints concerning breaches of customer privacy and losses of customer data,Metric not disclosed
197,,GRI 419: Socioeconomic Compliance 2016,,,
198,,,419-1,Non-compliance with laws and regulations in the social and economic area,Metric not disclosed
