Unnamed: 0,Industry,GRI Code,GRI Name,Disclosure,Disclosure Name,General Information,Initiative,Initiative from the undisclosed GRI (found by the coder but not mentioned in the GRI index table),UNDISCLOSED GRI,Organisation,Year,Solution Description,Solution Outcome,Digital tool,Data Source,Unnamed: 15,Unnamed: 16,Unnamed: 17,Keywords,SDGs,ESG,UNGC,Notes,Unnamed: 23,Unnamed: 24,Unnamed: 25,Unnamed: 26,Unnamed: 27,Unnamed: 28,Unnamed: 29,Unnamed: 30,Unnamed: 31,Unnamed: 32,Unnamed: 33,Unnamed: 34,Unnamed: 35,Unnamed: 36
0,,,,,,,,,,,,,,,GRI Index,SR,AR,CGS,,,,,,,,,,,,,,,,,,,
1,,2.0,General Disclosures,2-1,Organizational details,"Altium Limited, ACN 009 568 772 (Altium, we, our, or Company), develops software for the design of electronic products and provides an online collaboration platform to facilitate their manufacturing. Our software tools empower and connect printed circuit board (PCB) designers, part suppliers, and manufacturers to develop and manufacture electronics products faster and more efficiently than ever before. Altium is listed on the Australian Securities Exchange (ASX: ALU).",,,,Altium,2023.0,,,,,4,,,,,,,,,,,,,,,,,,,,,
2,,2.0,General Disclosures,2-2,Entities included in the organization's sustainability reporting,"Design Software (Altium Designer and Enterprise) and Cloud Platform (Altium 365, Nexar and Octopart)",,,,Altium,2023.0,,,,,,11,,,,,,,,,,,,,,,,,,,,
3,,2.0,General Disclosures,2-3,"Reporting period, frequency, and contact point","At the end of 30 June 2023, Suite 3, Level 6 Tower B, The Zenith 821 Pacific Highway Chatswood NSW 2067 Australia",,,,Altium,2023.0,,,,,6,2,,,,,,,,,,,,,,,,,,,,
4,,2.0,General Disclosures,2-4,Restatements of information,There have been no significant changes to the state of affairs of the Group during the year.,,,,Altium,2023.0,,,,,,26,,,,,,,,,,,,,,,,,,,,
5,,2.0,General Disclosures,2-5,External assurance,KPMG provides external assurance.,,,,Altium,2023.0,,,,,,2,,,,,,,,,,,,,,,,,,,,
6,,2.0,General Disclosures,2-6,"Activities, value chain and other business relationships",,,"The ""file-less"" data",,Altium,2023.0,"Co-simulation and Co-Design capabilities that connect the ECAD domain to the simulation and MCAD domains have been improved this year, marked by the announcement of integration programmes with Ansys and Siemens NX. The âfile-lessâ data exchange between systems brings collaboration to a new level, improving rigour and simplifying usability.",,,,,"5, 12",,"Co-simulation, Co-Design, Integration",9,E,,,,,,,,,,,,,,,,
7,,2.0,General Disclosures,2-6,"Activities, value chain and other business relationships",,,Bill of Materials (BOM) Management,,Altium,2023.0,"Bill of Materials (BOM) Management, a fundamental electronics lifecycle management system component, was delivered to early adopter customers with a BOM scrubbing capability. It will appeal to the procurement professional, underpinning our strategy to support collaboration between value chain stakeholders by delivering expanded capabilities for a wider set of personas. BOM Management provides an entry point to the platform that does not require native Altium design files for access and elevates the BOM to a first-class position concerning digital asset management.\t",,,,,"13, 14",,"BOM Management, Procurement, Collaboration",9,S,,,,,,,,,,,,,,,,
8,,2.0,General Disclosures,2-6,"Activities, value chain and other business relationships",,,Multi-CAD strategy,,Altium,2023.0,"Other exciting developments on Altium 365 include the advancement of our multi-CAD strategy with the introduction of support for the ODB++ format, a widely used data format supported by most solutions from eCAD vendors, and the new assembly app that targets the technician persona, streamlining the manual assembly and inspection of prototype boards. Support for additional ECAD vendors on the platform will be announced shortly, positioning Altium 365 as an inclusive, open platform for the broader electronics design community.\t",,,,,"13, 14",,"Multi-CAD Strategy, ODB++ Support, Inclusivity",9,S,,,,,,,,,,,,,,,,
9,,2.0,General Disclosures,2-6,"Activities, value chain and other business relationships",,,Ansys Co-Simulation integration,,Altium,2023.0,"Nexar is the basis for the Ansys Co-Simulation integration, which has made it easy not only for board-level information to be exchanged between the authoring tools but also makes commenting and markup straightforward, abstracting the complexities that would otherwise be encountered by providing a single, unified information model.",,,,,14,,"Nexar Integration, Co-Simulation, Information Model",9,S,,,,,,,,,,,,,,,,
10,,2.0,General Disclosures,2-6,"Activities, value chain and other business relationships",,,"""Designer Assist"" simulation model",,Altium,2023.0,"Similarly, the same approach works with Hexagon in the âDesigner Assistâ simulation model for the platform-to-platform integration between Altium 365 and Hexagon Nexus. Thermal simulation capabilities were democratized and delivered as a proof of concept for a âsimulation as a serviceâ experience in which the user does not have to be a simulation expert in a compressed timescale, thanks to Nexar.",,,,,"14, 15",,"Hexagon Nexus Integration, Simulation, Innovation",9,S,,,,,,,,,,,,,,,,
11,,2.0,General Disclosures,2-6,"Activities, value chain and other business relationships",,,Strategic and Operational risk,,Altium,2023.0,"Altium balances achieving long-term strategic objectives with achieving short-term commitments. It devotes significant time and resources to developing, monitoring, and reviewing its strategic direction, including the right balance between investment in the business and EBITDA margin. There are dedicated strategy sessions at the board level, teams assigned to programs critical to our strategy, and robust dashboards to monitor and highlight progress and risks. EY has been engaged in risk management for the company.\t",,,,,18,,"Strategic Objectives, Monitoring, Risk Management",8,G,,,,,,,,,,,,,,,,
12,,2.0,General Disclosures,2-6,"Activities, value chain and other business relationships",,,Innovation Risk Mitigation,,Altium,2023.0,"Innovation is central to the Altium strategic vision. The Company Leadership Team devotes considerable time and intellect to creating and maintaining a long-term, ambitious, innovative view. The strategy is assessed in the context of competition, technology developments and emerging threats.",,,,,18,,"Innovation, Long-term Vision, Competition",9,G,,,,,,,,,,,,,,,,
13,,2.0,General Disclosures,2-7,Employees,,,Employer brand and recruitment strategy,,Altium,2023.0,"During FY23, we re-imagined our employer brand and recruitment strategy. We focused on branding as a premier technology employer, seeking to create a competitive advantage in attracting rising star talent. Part of this was to establish the core pillars of our employer brand. These are four core pillars that set us apart and are uniquely Altiumâs",,,,,10,15,"Employer Branding, Recruitment, Talent Attraction",8,S,,,,,,,,,,,,,,,,
14,,2.0,General Disclosures,2-8,Workers who are not employees,,,,NO DISCLOSURE,Altium,2023.0,,,,,,,,,,,,,,,,,,,,,,,,,,
15,,2.0,General Disclosures,2-9,Governance structure and composition,"The Directors determine the Boardâs size and composition within the limits prescribed by Altiumâs Constitution, which requires a Board of between three and nine Directors. The Companyâs Board currently comprises five Directors, including three Non-executive Directors and two Executive Directors (CEO), Mr Aram Mirkazemi and President, Mr Sergiy Kostynsky)",,,,Altium,2023.0,,,,,,,3,,,,,,,,,,,,,,,,,,,
16,,2.0,General Disclosures,2-10,Nomination and selection of the highest governance body,"Each Executive and Non-executive Directorâs term of appointment is subject to the provisions of the Corporations Act, the ASX Listing Rules, and Altiumâs Constitution (as applicable to the relevant Director). New Non-executive Directors (appointed by the Board as casual vacancies) must seek election as directors at the Annual General Meeting (AGM) following their appointment. They will then stand for re-election on a rotational basis with other Directors. No Director (other than the CEO) may hold office without re-election following the third AGM following their appointment or three years, whichever is longer.",,,,Altium,2023.0,,,,,,,4,,,,,,,,,,,,,,,,,,,
17,,2.0,General Disclosures,2-11,Chair of the highest governance body,Non-Executive Chairman Samuel Weiss,,,,Altium,2023.0,,,,,,2,,,,,,,,,,,,,,,,,,,,
18,,2.0,General Disclosures,2-12,Role of the highest governance body in overseeing the management of impacts,"The role of the Board is to demonstrate leadership and provide overall strategic guidance, enhance the interests of Altiumâs shareholders, employees, and customers, and ensure Altium and its controlled entities, together referred to as the âGroupâ, are properly managed. The roles and responsibilities of the Board and management are set out in a Board Charter.",,,,Altium,2023.0,,,,,,,3,,,,,,,,,,,,,,,,,,,
19,,2.0,General Disclosures,2-13,Delegation of responsibility for managing impacts,"The Board has delegated authority for the operations and administration of the Altium Group to the Chief Executive Officer (CEO), including day-to-day management, implementation of corporate strategy, and providing the Board with accurate, timely and clear information on Altiumâs operations to enable the Board to perform its functions. The CEO is accountable to the Board for exercising this delegated authority and that of the management group of Altium.",,,,Altium,2023.0,,,,,,,3,,,,,,,,,,,,,,,,,,,
20,,2.0,General Disclosures,2-14,Role of the highest governance body in sustainability reporting,"During the FY23 reporting period, the Board reviewed the roles and responsibilities of the Board and its Committees, particularly the Boardâs oversight of risk-related matters. Following this review, it was determined that in FY24, a standalone Risk Management and Governance Committee would be established. The proposed structure is consistent with market-leading approaches, and the standalone Risk Management and Governance Committee will have oversight and responsibility for risk management and governance, including Altiumâs risk management framework, material and emerging risks and the Companyâs governance and compliance framework.",,,,Altium,2023.0,,,,,,,3,,,,,,,,,,,,,,,,,,,
21,,2.0,General Disclosures,2-15,Conflict of interest,"Directors are required to take all reasonable steps to avoid actual, potential, or perceived conflicts of interest. Under the Corporations Act, Altiumâs Constitution and the Board Charter, Directors must disclose any conflicts and abstain from participating in any discussion or voting on matters in which they have a personal interest. A Director who discloses that they may have a conflict must follow the procedures developed by the Board to deal with such circumstances.",,,,Altium,2023.0,,,,,,,7,,,,,,,,,,,,,,,,,,,
22,,2.0,General Disclosures,2-16,Communication of critical concerns,"Altiumâs Whistleblower Policy encourages employees to report any actual or suspected conduct within the Altium Group that may be unethical, illegal, fraudulent, or undesirable. It includes conduct by an Altium Director, officer, employee, contractor, supplier, or other person who has business dealings with Altium.",,,,Altium,2023.0,,,,,,,13,,,,,,,,,,,,,,,,,,,
23,,2.0,General Disclosures,2-17,Collective knowledge of the highest governance body,"The Board recognises the importance of ensuring its members possess a broad range of skills, knowledge, experience and diversity. With the assistance of the Human Resources Committee, the board has developed a board skills matrix that sets out the mix of skills, expertise, experience, and diversity that the board currently has or seeks to introduce to its membership. The Board and Human Resources Committee periodically evaluate the Board skills matrix to determine whether it continues to align with and uphold Altiumâs transformative strategic agenda, the appropriate discharge of responsibilities and duties by the Board, and an appropriate level of competence to confront current and emerging issues relevant to Altium.",,,,Altium,2023.0,,,,,,,4,,,,,,,,,,,,,,,,,,,
24,,2.0,General Disclosures,2-18,Evaluation of the performance of the highest governance body,"The Human Resources Committee is responsible under its Charter for overseeing the development and implementation of a process for evaluating the performance of the Board, Board Committees and individual Directors. At the recommendation of the Human Resources Committee, the Board engaged an external consultant to undertake an evaluation of FY23 to determine the effectiveness of Board meetings, discussion, and information sharing. Evaluations and interviews were conducted with each member of the Board and the Company Secretary. A report was delivered to the Committee to implement recommendations during FY24.",,,,Altium,2023.0,,,,,,,10,,,,,,,,,,,,,,,,,,,
25,,2.0,General Disclosures,2-19,Remuneration policies,"During the year that ended 30 June 2023, the HR Committee and Board selected three performance measures: Revenue, profitability, and volume. These Measures have been designed to remain consistent under the LTI Plan and uphold Altiumâs commitment to deliver both strong top-line revenue growth and increasing levels of profitability over time. To assess performance against the Measures, entry gateway (80%) and stretch (125%) targets were set for four key Metrics in respect of the period: group revenue (weighted 40%), underlying EBITDA margin (weighted 30%), active subscription seats (weighted 15%), and Altium 365 Adoption (weighted 15%).",,,,Altium,2023.0,,,,,,28,,,,,,,,,,,,,,,,,,,,
26,,2.0,General Disclosures,2-20,Process to determine remuneration,,,Remuneration governance,,Altium,2023.0,"Altium has a remuneration governance structure, with a separate HR Committee to support the Board in overseeing the Groupâs remuneration strategy, policies, and practices. Non-executive Directors attend all Board meetings and are invited to committee meetings where they are not members. Members of the HR Committee are fully aware of any issues or discussions arising during the Audit and Risk Management Committee meetings, and vice versa, enabling a comprehensive assessment of any relevant risk considerations in remuneration decision-making.",,,,,"27, 41",,"Remuneration Governance, Board Oversight, Policies",16,G,,,,,,,,,,,,,,,,
27,,2.0,General Disclosures,2-21,Annual total compensation ratio,,,,NO DISCLOSURE,Altium,2023.0,,,,,,,,,,,,,,,,,,,,,,,,,,
28,,2.0,General Disclosures,2-22,Statement on sustainable development strategy,"We intend to do our part. We intend to manage our business in a manner that positively impacts our people, customers, shareholders, local communities, and the environment. We also intend to address the impacts as identified in our Materiality Assessment. We support the objectives of the United Nationâs Sustainable Development Goals (UN SDGs).",,,,Altium,2023.0,,,,,7,,,,,,,,,,,,,,,,,,,,,
29,,2.0,General Disclosures,2-23,Policy commitments,"We are committed to respecting all employees and complying with our Human Rights Policy. We strictly prohibit the use of slavery, forced labour and human trafficking.",,,,Altium,2023.0,,,,,13,,,,,,,,,,,,,,,,,,,,,
30,,2.0,General Disclosures,2-24,Embedding policy commitments,We have completed a comprehensive modern slavery risk assessment and gap analysis. The assessment and analysis give us a baseline for an Altium roadmap for anti-modern slavery initiatives. We reaffirm our commitment to preventative action and supply chain diligence to prevent modern slavery.,,,,Altium,2023.0,,,,,3,,,,,,,,,,,,,,,,,,,,,
31,,2.0,General Disclosures,2-25,Processes to remediate negative impacts,"Our Support team assesses performance by measuring Customer Satisfaction (CSAT) and Net Promoter Scores (NPSs). We also collect feedback on the usefulness of our documentation, and customers are encouraged to provide feedback. Any feedback from customers regarding new functionality and bug identification is directly shared with our Product team for appropriate response and remediation where necessary.\t",,,,Altium,2023.0,,,,,23,,,,,,,,,,,,,,,,,,,,,
32,,2.0,General Disclosures,2-26,Mechanisms for seeking advice and raising concern,"Appropriate internal and external channels have been implemented to ensure that any reports of wrongdoing are handled fairly, sensitively, and confidentially. It includes the provision of the Altium Whistleblower Service, an independent whistleblowing service managed by Deloitte.",,,,Altium,2023.0,,,,,,,13,,,,,,,,,,,,,,,,,,,
33,,2.0,General Disclosures,2-27,Compliance with laws and regulations,The Group has Grouped all new accounting standards and interpretations issued by the Australian Accounting Standards Board (âAASBâ) and determined that none of these standards and interpretations materially impacted the Group duriGroupe year ended 30 June 2023. No new or amended standards and interpretations are expected to significantly impact the Groupâs financial statements.,,,,Altium,2023.0,,,,,,53,,,,,,,,,,,,,,,,,,,,
34,,2.0,General Disclosures,2-28,Membership associations,We maintain an active membership and engagement with recognised professional groups such as the International Association of Privacy Professionals (IAAP) and ISACA (previously known as the Information System and Audit and Control Association).,,,,Altium,2023.0,,,,,28,,,,,,,,,,,,,,,,,,,,,
