Unnamed: 0,Unnamed: 0.1,Unnamed: 1,Unnamed: 2,Unnamed: 3,Unnamed: 4
53,,,"201-4 Financial assistance received from government\na. Total monetary value of financial assistance received by the organization from any government during the reporting period, including:\ni. tax relief and tax credits\nii. subsidies\niii. investment grants, research and development grants, and other relevant types of grant\niv. awards\nv. royalty holidays\nvi. financial assistance from Export Credit Agencies (ECAs)\nvii. financial incentives\nviii. other financial benefits received or receivable from any government for any operation\nb. The information in 201-4-a by country.\nc. Whether, and the extent to which any government is present in the shareholding structure.","a. to c. As appropriate, we may consider enhancing our disclosures for this topic in coming years.",
54,,PROCUREMENT PRACTICES,,,
55,,GRI 204: \nProcurement Practices 2016,204-1 Proportion of spending on local suppliers\na. Percentage of the procurement budget used for significant locations of operation that is spent on suppliers local to that operation (such as percentage of products and services purchased locally).\nb. The organizationâs geographical definition of âlocalâ.\nc. The definition used for âsignificant locations of operationâ.,"a. to c. See our 2023 Sustainability Index and Datasheet: tabs Suppliers (Total supplier and other relevant third party spend table) and Glossary\n\nAs appropriate, we may consider enhancing our disclosures for this topic in coming years.",
56,,ANTI-CORRUPTION,,,
57,,GRI 205: \nAnti-corruption 2016,205-1 Operations assessed for risks related to corruption\na. Total number and percentage of operations assessed for risks related to corruption.\nb. Significant risks related to corruption identified through the risk assessment.\n,"a. Our Risk Management Strategy applies to all our people within Westpac and its subsidiaries. Each of our operations are assessed for bribery and corruption risk as part of our enterprise risk management process.\n\nb. Information on our risk management process can be found in the 2023 Annual Report (Risk management section), and references to Major Risk Category 9. Financial Crime which includes Bribery and Corruption as a financial crime class. Information on our risk factors has also been included under the Risk Factors section of the Group Performance disclosures on ""The failure to comply with financial crime obligations has had, and could have further, adverse effects on our business and reputation"".",
58,,,"205-2 Communication and training about anti-corruption policies and procedures\na. Total number and percentage of governance body members that the organizationâs anti-corruption policies and procedures have been communicated to, broken down by region.\nb. Total number and percentage of employees that the organizationâs anti-corruption policies and procedures have been communicated to, broken down by employee category and region.\nc. Total number and percentage of business partners that the organizationâs anti-corruption policies and procedures have been communicated to, broken down by type of business partner and region. Describe if the organizationâs anti-corruption policies and procedures have been communicated to any other persons or organisations.\nd. Total number and percentage of governance body members that have received training on anti-corruption, broken down by region.\ne. Total number and percentage of employees that have received training on anti-corruption, broken down by employee category and region.","a. Westpac Board members and all employees are required to complete Financial Crime Awareness training which includes training on our ABC Policy and procedures, prohibiting all forms of bribery and corruption. We are working to improve disclosures in this respect for future periods.\n\nb. All employees and contractors are required to complete Financial Crime Awareness training which includes our ABC Policy and procedures, prohibiting all forms of bribery and corruption. \n\nc. Third Parties can access our published ABC Policy on the Westpac webpage. The Westpac Group Supplier Code of Conduct, supports standard ABC contractual clauses with Third Parties, reinforcing our ABC Policy position and related compliance expectations.\n\nd., e. We are working to improve disclosures in this respect for future periods.",
59,,,205-3 Confirmed incidents of corruption and actions taken\na. Total number and nature of confirmed incidents of corruption.\nb. Total number of confirmed incidents in which employees were dismissed or disciplined for corruption.\nc. Total number of confirmed incidents when contracts with business partners were terminated or not renewed due to violations related to corruption.\nd. Public legal cases regarding corruption brought against the organization or its employees during the reporting period and the outcomes of such cases.\n,"a., b., c. We do not report against these requirements due to confidentiality constraints. These constraints include the maintenance of legal professional privilege.\n\nd. No public legal cases regarding corruption have been brought against the organisation or its employees during the reporting period.",
60,,ANTI-COMPETITIVE BEHAVIOUR,,,
61,,GRI 206: Anti-competitive Behaviour 2016,"206-1 Legal actions for anti-competitive behavior, anti-trust, and monopoly practices\na. Number of legal actions pending or completed during the reporting period regarding anti-competitive behavior and violations of anti-trust and monopoly legislation in which the organization has been identified as a participant.\nb. Main outcomes of completed legal actions, including any decisions or judgments.","a., b. See our 2023 Annual Report: Significant developments, litigation and regulatory proceedings",
62,,TAX,,,
63,,GRI 207:\nTax 2019,"207-1 Approach to tax\na. A description of the approach to tax, including:\ni. whether the organisation has a tax strategy available and, if so, a link to this strategy if publicly\nii. the governance body or executive-level position within the organisation that formally reviews and approves the tax strategy, and the frequency of this review\niii. the approach to regulatory compliance\niv. how the approach to tax is linked to the business and sustainable development strategies of the organisation","a. See our Website: Approach to Tax, latest Tax Transparency Report, 2023 Annual Report: Corporate Governance Statement",
64,,,"207-2 Tax governance, control, and risk management\na. A description of the tax governance and control framework, including:\ni. the governance body or executive-level position within the organization accountable for compliance with the tax strategy\nii. how the approach to tax is embedded within the organization\niii. the approach to tax risks, including how risks are identified, managed, and monitored\niv. how compliance with the tax governance and control framework is evaluated\nb. A description of the mechanisms for reporting concerns about unethical or unlawful behaviour and the organizationâs integrity in relation to tax.\nc. A description of the assurance process for disclosures on tax and, if applicable, a reference to the assurance report, statement, or opinion.","a., b. See our Website: Approach to Tax, latest Tax Transparency Report, 2023 Annual Report: Corporate Governance\nc. See our 2023 Annual Report: Statutory statements",
65,,,"207-3 Stakeholder engagement and management of concerns related to tax\na. A description of the approach to stakeholder engagement and management of stakeholder concerns related to tax, including:\ni. the approach to engagement with tax authorities\nii. the approach to public policy advocacy on tax\niii. the processes for collecting and considering the views and concerns of stakeholders, including external stakeholders","a. See our Website: Approach to Tax, latest Tax Transparency Report, 2023 Annual Report: Our sustainability materiality assessment process",
66,,,"207-4 Country-by-country reporting\na. All tax jurisdictions where the entities included in the organizationâs audited consolidated financial statements, or in the financial information filed on public record, are resident for tax purposes.\nb. For each tax jurisdiction reported in Disclosure 207-4-a:\ni. names of the resident entities\nii. primary activities of the organization\niii. number of employees, and the basis of calculation of this number\niv. revenues from third-party sales\nv. revenues from intra-group transactions with other tax jurisdictions\nvi. profit/loss before tax\nvii. tangible assets other than cash and cash equivalents\nviii. corporate income tax paid on a cash basis\nix. corporate income tax accrued on profit/loss\nx. reasons for the difference between corporate income tax accrued on profit/loss and the tax due if the statutory tax rate is applied to profit/loss before tax\nc. The time period covered by the information reported in Disclosure 207-4.","a., b., c. See our Website: Approach to Tax, latest Tax Transparency Report, 2023 Annual Report: Financial Statements\nb. As appropriate, we may consider enhancing our disclosures for this topic in coming years. This includes any proposed legislative changes to Public country-by-country reporting that may apply.",
67,,ENVIRONMENT,,,
68,,ENERGY,,,
69,,GRI 302:\nEnergy 2016,"302-1 Energy consumption within the organization\na. Total fuel consumption within the organization from non-renewable sources, in joules or multiples, and including fuel types used.\nb. Total fuel consumption within the organization from renewable sources, in joules or multiples, and including fuel types used.\nc. In joules, watt-hours or multiples, the total:\ni. electricity consumption\nii. heating consumption\niii. cooling consumption\niv. steam consumption\nd. In joules, watt-hours or multiples, the total:\ni. electricity sold\nii. heating sold\niii. cooling sold\niv. steam sold\ne. Total energy consumption within the organization, in joules or multiples.\nf. Standards, methodologies, assumptions, and/or calculation tools used.\ng. Source of the conversion factors used.","a., b., c. i), ii), iii), e., f., g. See our 2023 Sustainability Index and Datasheet â tab Environmental (Energy Consumption table) and Glossary.\nc., iv., d. We do not report on steam consumption or energy sold as these are not applicable to Westpac.",
70,,,"302-2 Energy consumption outside of the organization\na. Energy consumption outside of the organization, in joules or multiples.\nb. Standards, methodologies, assumptions, and/or calculation tools used.\nc. Source of the conversion factors used.","a. to c. As appropriate, we may consider enhancing our disclosures for this topic in coming years.",
71,,,"302-3 Energy intensity\na. Energy intensity ratio for the organization.\nb. Organization-specific metric (the denominator) chosen to calculate the ratio.\nc. Types of energy included in the intensity ratio; whether fuel, electricity, heating, cooling, steam, or all.\nd. Whether the ratio uses energy consumption within the organization, outside of it, or both.","a., d. See our 2023 Sustainability Index and Datasheet â tab Environment (Energy Consumption table) and Glossary.\nb. Employee full time equivalent chosen as the denominator to calculate our energy intensity metric \nc. Energy consumption within the organisation chosen as the numerator to calculate our energy intensity metric",
72,,,"302-4 Reduction of energy consumption\na. Amount of reductions in energy consumption achieved as a direct result of conservation and efficiency initiatives, in joules or multiples.\nb. Types of energy included in the reductions; whether fuel, electricity, heating, cooling, steam, or all.\nc. Basis for calculating reductions in energy consumption, such as base year or baseline, including the rationale for choosing it.\nd. Standards, methodologies, assumptions, and/or calculation tools used.","a. Renewables data reported but not efficiency and conservation due to availability of reliable data. As appropriate, we may consider enhancing our disclosures for this topic in coming years.\n \nb. to d. See our 2023 Annual Report: Creating value for the environment, 2023 Climate Report: Strategy; 2023 Sustainability Index and Datasheet â tab Environment (Energy consumption table) and Glossary.",
73,,,"302-5 Reductions in energy requirements of products and services\na. Reductions in energy requirements of sold products and services achieved during the reporting period, in joules or multiples.\nb. Basis for calculating reductions in energy consumption, such as base year or baseline, including the rationale for choosing it.\nc. Standards, methodologies, assumptions, and/or calculation tools used.",a. to c. We do not consider this GRI standard to be applicable to banking.,
