Unnamed: 0,Unnamed: 0.1,Unnamed: 1,Unnamed: 2,Unnamed: 3,Unnamed: 4,Unnamed: 5,Unnamed: 6,Unnamed: 7,Unnamed: 8,Unnamed: 9,Unnamed: 10,Unnamed: 11,Unnamed: 12,Unnamed: 13,Unnamed: 14,Unnamed: 15,Unnamed: 16,Unnamed: 17,Unnamed: 18,Unnamed: 19,Unnamed: 20,Unnamed: 21,Unnamed: 22,Unnamed: 23,Unnamed: 24,Unnamed: 25,Unnamed: 26,Unnamed: 27,Unnamed: 28
24,,"c) Describe how processes for identifying, assessing, and managing climate-related risks are integrated into the organizationâs overall risk management.","Organizations should describe how their processes for identifying, assessing, and managing climate-related risks are integrated into their overall risk management.",None,See our 2023 Annual Report: Section 1 â Risk management; Section 2 â Sustainability governance and risk management\n\nSee our 2023 Climate Report: \nPage 39 - 44: Risk Management\n,,,,,,,,,,,,,,,,,,,,,,,,
25,,METRICS AND TARGETS: Disclose the metrics and targets used to assess and manage relevant climate-related risks and opportunities where such information is material.,,,,,,,,,,,,,,,,,,,,,,,,,,,
26,,a) Disclose the metrics used by the organization to assess climate-related risks and opportunities in line with its strategy and risk management process.,"Organizations should provide the key metrics used to measure and manage climate-related risks and opportunities, as well as metrics consistent with the cross-industry, climate-related metric categories.\nOrganizations should consider including metrics on climate-related risks associated with water, energy, land use, and waste management where relevant and applicable.\nWhere climate-related issues are material, organizations should consider describing whether and how related performance metrics are incorporated into remuneration policies.\nWhere relevant, organizations should provide their internal carbon prices as well as climate-related opportunity metrics such as revenue from products and services designed for a low-carbon economy. \nMetrics should be provided for historical periods to allow for trend analysis.\nWhere appropriate, organizations should consider providing forward-looking metrics for the cross-industry, climate-related metric categories, consistent with their business or strategic planning time horizons. In addition, where not apparent, organizations should provide a description of the methodologies used to calculate or estimate climate-related metrics.","Banks should provide the metrics used to assess the impact of (transition and physical) climate-related risks on their lending and other financial intermediary business activities in the short, medium, and long term. Metrics provided may relate to credit exposure, equity and debt holdings, or trading positions, broken down by:\nâ Industry\nâ Geography\nâ Credit quality (e.g., investment grade or non-investment grade, internal rating\nsystem)\nâ Average tenor\nBanks should also provide the amount and percentage of carbon-related assets relative to total assets as well as the amount of lending and other financing connected with climate-related opportunities.","See our 2023 Annual Report: Section 1 â Creating value for the Environment; Section 2 â Sustainability governance and risk management\n\nSee our 2023 Sustainability Index and Datasheet - tabs Environment; and Lending\n\nSee our 2023 Climate Report:\nPage 6 - 7: FY23 Highlights\nPage 21 - 22: Strategy (Net-zero, climate resilient operations)\nPage 27 - 28, 32: Strategy (Supporting customers transition to net-zero)\nPage 40 - 44: Risk Management\n",,,,,,,,,,,,,,,,,,,,,,,,
27,,"b) Disclose Scope 1, Scope 2, and, if appropriate, Scope 3 greenhouse gas (GHG) emissions, and the related risks.","Organizations should provide their Scope 1 and Scope 2 GHG emissions independent of a materiality assessment, and, if appropriate, Scope 3 GHG emissions and the related risks. All organizations should consider disclosing Scope 3 GHG emissions.\nGHG emissions should be calculated in line with the GHG Protocol methodology to allow for aggregation and comparability across organizations and jurisdictions. As appropriate, organizations should consider providing related, generally accepted industry-specific GHG efficiency ratios.\nGHG emissions and associated metrics should be provided for historical periods to allow for trend analysis. In addition, where not apparent, organizations should provide a description of the methodologies used to calculate or estimate the metrics.",None,"See our 2023 Annual Report: Section 1 â Creating value for the Environment\n\nSee our 2023 Sustainability Index and Datasheet - tabs Environment; and Lending\n\nSee our 2023 Climate Report:\nPage 22: Strategy (Net-zero, climate resilient operations)\nPage 28: Strategy (Supporting customers transition to net-zero)\n",,,,,,,,,,,,,,,,,,,,,,,,
28,,c) Describe the targets used by the organization to manage climate-related risks and opportunities and performance against targets.,"Organizations should describe their key climate-related targets such as those related to GHG emissions, water usage, energy usage, etc., and in line with anticipated regulatory requirements or market constraints or other goals. Other goals may include efficiency or financial goals, financial loss tolerances, avoided GHG emissions through the entire product life cycle, or net revenue goals for products and services designed for a low-carbon economy. \nIn describing their targets, organizations should consider including the following:\nâ¢ whether the target is absolute or intensity based;\nâ¢ time frames over which the target applies;\nâ¢ base year from which progress is measured; and\nâ¢ key performance indicators used to assess progress against targets.\nOrganizations disclosing medium-term or long-term targets should also disclose associated interim targets in aggregate or by business line, where available.\nWhere not apparent, organizations should provide a description of the methodologies used to calculate targets and measures.",None,"See our 2023 Annual Report: Section 1 â Creating value for the Environment\n\nSee our 2023 Sustainability Index and Datasheet - tabs Environment; and Lending\n\nSee our 2023 Climate Report:\nPage 18 - 20: Strategy (Net-zero, climate resilient operations)\nPage 24 - 25, 28, 35: Strategy (Supporting customers transition to net-zero)",,,,,,,,,,,,,,,,,,,,,,,,
31,,"TCFD CROSS-INDUSTRY, CLIMATE-RELATED METRIC CATEGORIES AND EXAMPLE METRICS",,,,,,,,,,,,,,,,,,,,,,,,,,,
34,,,METRIC CATEGORIES,UNIT OF MEASURE,WESTPAC RESPONSE,,,,,,,,,,,,,,,,,,,,,,,,
35,,CROSS-INDUSTRY METRICS,"GHG Emissions\nAbsolute Scope 1, Scope 2, and Scope 3;\nemissions intensity",MtCO2-e or (tCOâ-e)/employee (FTE),See our 2023 Sustainability Index and Datasheet - tabs Environment ('Group GHG emissions' and âLocation-based GHG emissions breakdownâ tables); and Lending (Estimated financed emissions; and Sector targets in line with our NZBA commitment tables),,,,,,,,,,,,,,,,,,,,,,,,
36,,,Transition Risks\nAmount and extent of assets or business activities vulnerable to transition risks,Amount or percentage,See our 2023 Sustainability Index and Datasheet - tab Lending ('Group exposure by sector'; âSectors that may face relatively higher growth constraints from transition riskâ and âClimate scenario analysis on key portfoliosâ tables)\n\n,,,,,,,,,,,,,,,,,,,,,,,,
37,,,Physical Risks\nAmount and extent of assets or business activities vulnerable to physical risks,Amount or percentage,See our 2023 Sustainability Index and Datasheet - tab Lending (âAustralian mortgages -Potential physical risks under different climate change scenariosâ and âClimate scenario analysis on key portfoliosâ tables),,,,,,,,,,,,,,,,,,,,,,,,
38,,,"Climate-Related\nOpportunities Proportion of revenue, assets, or other business activities aligned with climate-related opportunities",Amount or percentage,See our 2023 Sustainability Index and Datasheet - tab Lending ('Group exposure by sector'; and âClimate change solutions exposureâ tables)\n\n,,,,,,,,,,,,,,,,,,,,,,,,
39,,,"Capital Deployment\nAmount of capital expenditure, financing, or investment deployed toward climate-related risks and opportunities",Reporting currency,As a bank (a services business) we are not a capital intensive business and so funds deployed to climate-related risks and opportunities for our operations is not material. Through our activities we provide significant finance towards climate-related risks and opportunities. These are described in our 2023 Climate Report.,,,,,,,,,,,,,,,,,,,,,,,,
40,,,Internal Carbon Prices\nPrice on each ton of GHG emissions used internally by an\norganization,"Price in reporting currency, per MtCO2-e",Westpac does not currently place a price on the carbon it uses internally.,,,,,,,,,,,,,,,,,,,,,,,,
