Unnamed: 0,Industry,GRI Code,GRI Name,Disclosure,Disclosure Name,General Information,Initiative,Initiative from the undisclosed GRI (found by the coder but not mentioned in the GRI index table),UNDISCLOSED GRI,Organisation,Year,Solution Description,Solution Outcome,Digital tool,Data Source,Unnamed: 15,Unnamed: 16,Unnamed: 17,Keywords,SDGs,ESG,UNGC,Notes,Unnamed: 23,Unnamed: 24,Unnamed: 25,Unnamed: 26,Unnamed: 27,Unnamed: 28,Unnamed: 29,Unnamed: 30,Unnamed: 31,Unnamed: 32,Unnamed: 33,Unnamed: 34,Unnamed: 35,Unnamed: 36
50,,201.0,Economic Performance,201-02,Financial implications and other risks and opportunities due to climate change,"Key findings from the assessment include:\nâ¢ The financial impact of physical climate risk in the store network is not materially significant in the context of Colesâ total portfolio, which is well diversified across assets and regions. In addition, concerning store design, the specifications already consider future conditions to improve resilience in extreme weather (for example, new stores are designed for a one-in-100-year storm event). The design brief is frequently updated.\nâ¢ Flooding events drive approximately 60% of financial losses across the portfolio. The financial impact of flooding events is estimated to increase by around 23% over the next 10 years when assessing against RCP 8.5 2030 (Intergovernmental Panel on Climate Change high-emissions scenario).\nâ¢ The distribution network (distribution centres and transport routes) was found to be the area of highest risk due to the scale of potential downstream impacts. Therefore, the distribution network's resilience is a critical consideration in all operations and future asset planning.\nâ¢ Coles highly relies on asset integrity and the function of third-party assets, such as transport\ninfrastructure, distribution centres and shopping centres. In FY24, we will use these findings to\ninform our climate risk management approach.",,,,Coles,2023.0,,,,Sustainaility_Data_Pack,,44,,,,,,,,,,,,,,,,,,,,
51,,201.0,Economic Performance,201-04,Financial assistance received from government,No material financial assistance was identified.,,,,Coles,2023.0,,,,Sustainaility_Data_Pack,Sustainaility_Data_Pack,,,,,,,,,,,,,,,,,,,,,
52,,202.0,Market Presence,202-01,Ratios of standard entry level wage by gender compared to local minimum wage,"For the significant proportion of Coles team members, their base pay rate is set by the relevant enterprise agreement (referred to in GRI 2-30). The individual team members' classification and employment category determine their applicable pay rate. For appropriate industrial instruments governing employment conditions for Coles team members, the annual minimum wage rates ordered by the Fair Work Commission and proper award reference instruments are considered reference points.",,,,Coles,2023.0,,,,Sustainaility_Data_Pack,Sustainaility_Data_Pack,,,,,,,,,,,,,,,,,,,,,
53,,202.0,Market Presence,202-02,Proportion of senior management hired from the local community,Information is unavailable/incomplete.,,,NO DISCLOSURE,Coles,2023.0,,,,Sustainaility_Data_Pack,Sustainaility_Data_Pack,,,,,,,,,,,,,,,,,,,,,
54,,203.0,Indirect Economic Impacts,203-01,Infrastructure investments and services supported,Capital investment in infrastructure spending on stores and distribution centres is detailed in our 2023 Annual Report 2023. Our 2023 Sustainability Report p.50-52 details community investments and support.,,,,Coles,2023.0,,,,Sustainaility_Data_Pack,Sustainaility_Data_Pack,,,,,,,,,,,,,,,,,,,,,
55,,203.0,Indirect Economic Impacts,203-02,Significant indirect economic impacts,Information is unavailable/incomplete.,,,NO DISCLOSURE,Coles,2023.0,,,,Sustainaility_Data_Pack,Sustainaility_Data_Pack,,,,,,,,,,,,,,,,,,,,,
56,,204.0,Procurement Practices,204-01,Proportion of spending on local suppliers,Confidentiality Constraints,,,,Coles,2023.0,,,,Sustainaility_Data_Pack,Sustainaility_Data_Pack,,,,,,,,,,,,,,,,,,,,,
57,,205.0,Anti-corruption,205-01,Operations assessed for risks related to corruption,"Coles conducts risk assessments across its operations, and investigations are commenced where required. Due diligence checks and independent audits are conducted on suppliers as part of our Ethical Sourcing Program.",,,,Coles,2023.0,,,,Sustainaility_Data_Pack,Sustainaility_Data_Pack,,,,,,,,,,,,,,,,,,,,,
58,,205.0,Anti-corruption,205-02,Communication and training about anti-corruption policies and procedures,"Coles has a suite of governance policies, including our Code of Conduct, Anti-Bribery Policy, Political Donations Policy and Whistleblower Policy, designed to create a culture of acting lawfully and ethically. Our Whistleblowing service is available 24 hours a day. Our policies are accessible online, and we provide relevant personnel Anti-Bribery and Corruption training annually.",,,,Coles,2023.0,,,,Sustainaility_Data_Pack,Sustainaility_Data_Pack,,,,,,,,,,,,,,,,,,,,,
59,,205.0,Anti-corruption,205-03,Confirmed incidents of corruption and actions taken,There were no confirmed incidents of corruption by Coles Group or its team members under our Anti-Bribery Policy during the reporting period.,,,,Coles,2023.0,,,,Sustainaility_Data_Pack,Sustainaility_Data_Pack,,,,,,,,,,,,,,,,,,,,,
60,,206.0,Anti-competitive Behavior,206-01,"Legal actions for anti-competitive behavior, anti-trust, and monopoly practices","No legal action was taken during the reporting period for anti-competitive behaviour, anti-trust or monopoly practices by Coles Group or its employees.",,,,Coles,2023.0,,,,Sustainaility_Data_Pack,Sustainaility_Data_Pack,,,,,,,,,,,,,,,,,,,,,
61,,207.0,Tax,207-01,Approach to tax,"â¢ A commitment to good corporate citizenship and acting with integrity and transparency in tax matters\nâ¢ Diligence and care about tax matters, ensuring compliance with applicable laws and regulations\nâ¢ A low appetite for tax risk, adopting conservative positions",,,,Coles,2023.0,,,,Sustainaility_Data_Pack,3,,,,,,,Tax Contribution Report - 2023,,,,,,,,,,,,,,
62,,207.0,Tax,207-02,"Tax governance, control, and risk management","â¢ The Board oversees tax risk, evaluates our tax risk management framework and delegates relevant powers to the Audit and Risk Committee\nâ¢ Rigorous processes in place for risk assessment, reporting and escalation of tax risks to senior management, the Audit and Risk Committee and the Board\nâ¢ The Coles Tax Governance Framework, approved by the Audit and Risk Committee, sets out accountabilities, procedures, internal audit requirements, and documentation",,,,Coles,2023.0,,,,Sustainaility_Data_Pack,3,,,,,,,Tax Contribution Report - 2023,,,,,,,,,,,,,,
63,,207.0,Tax,207-03,Stakeholder engagement and management of concerns related to tax,"â¢ Engage with and maintain an open, proactive, and cooperative relationship with all revenue authorities\nâ¢ Part of the Australian Taxation Office (âATOâ) âTop 100 justified trust programâ for income tax and goods and services tax\nâ¢ ATO annual pre-lodgment compliance review of Colesâ consolidated group income tax return, covering material transactions and treatments adopted.",,,,Coles,2023.0,,,,Sustainaility_Data_Pack,3,,,,,,,Tax Contribution Report - 2023,,,,,,,,,,,,,,
64,,207.0,Tax,207-04,Country-by-country reporting,Colesâ contribution to the Australian economy in 2023 was $2.1 billion of taxes paid to and collected on behalf of Australian Government authorities.,,,,Coles,2023.0,,,,Sustainaility_Data_Pack,4,,,,,,,Tax Contribution Report - 2023,,,,,,,,,,,,,,
65,,301.0,Materials,301-01,Materials used by weight or volume,Not Applicable,,,NO DISCLOSURE,Coles,2023.0,,,,Sustainaility_Data_Pack,Sustainaility_Data_Pack,,,,,,,,,,,,,,,,,,,,,
66,,301.0,Materials,301-02,Recycled input materials used,Not Applicable,,,NO DISCLOSURE,Coles,2023.0,,,,Sustainaility_Data_Pack,Sustainaility_Data_Pack,,,,,,,,,,,,,,,,,,,,,
67,,301.0,Materials,301-03,Reclaimed products and thei packaging materials,Not Applicable,,,NO DISCLOSURE,Coles,2023.0,,,,Sustainaility_Data_Pack,Sustainaility_Data_Pack,,,,,,,,,,,,,,,,,,,,,
68,,302.0,Energy,302-01,Energy consumption within the organization,"The total energy consumption was 6,315,055 in FY23.",,,,Coles,2023.0,,,,Sustainaility_Data_Pack,Sustainaility_Data_Pack - Energy and S1+S2 Emission,,,,,,,,,,,,,,,,,,,,,
69,,302.0,Energy,302-02,Energy consumption outside of the organization,Information is unavailable/incomplete.,,,NO DISCLOSURE,Coles,2023.0,,,,Sustainaility_Data_Pack,Sustainaility_Data_Pack,,,,,,,,,,,,,,,,,,,,,
70,,302.0,Energy,302-03,Energy intensity,"The Energy Intensity was 156,0 GJ/$M sales revenue in FY23.",,,,Coles,2023.0,,,,Sustainaility_Data_Pack,Sustainaility_Data_Pack - Energy and S1+S2 Emission,,,,,,,,,,,,,,,,,,,,,
71,,302.0,Energy,302-04,Reduction of energy consumption,Information is unavailable/incomplete.,,,NO DISCLOSURE,Coles,2023.0,,,,Sustainaility_Data_Pack,Sustainaility_Data_Pack,,,,,,,,,,,,,,,,,,,,,
72,,302.0,Energy,302-04,Reduction of energy consumption,,Climate Action Roadmap,,,Coles,2023.0,"Building on work undertaken over the past three years to align our approach with the 2017 recommendations of the Task Force on Climate-Related Financial Disclosures, this year, we commenced the development of a Climate Action Roadmap (âthe Roadmapâ). The Roadmap is anticipated to include critical actions for Coles over the short, medium, and long term to effectively manage climate-related risks and opportunities and respond to stakeholder expectations.",,,Sustainaility_Data_Pack,14,,,"Task Force on Climate-Relted Financial Disclosure, Climate Action Roadmap, Risks and Opportunities",13,E,,,,,,,,,,,,,,,,
73,,302.0,Energy,302-04,Reduction of energy consumption,,Decarbonisation,,,Coles,2023.0,"Coles is a significant energy user and producer of greenhouse gas emissions, directly in our operations and indirectly through our extensive supply chains. We are committed to increasing resource efficiency and reducing emissions in areas we control and influence.",,,Sustainaility_Data_Pack,14,,,"Greenhouse Gas Emissions, Extensive Supply Chains, Resource Efficiency",13,E,,,,,,,,,,,,,,,,
74,,302.0,Energy,302-04,Reduction of energy consumption,,CERT Report Participation,,,Coles,2023.0,"Following the successful pilot of the Corporate Emissions Reduction Transparency (CERT) report, codesigned by the Clean Energy Regulator and industry, in 2022, Coles continued participating in and promoting the CERT report. The 2023 submission has evolved further and helps encourage emissions reductions in Australia by allowing companies to set emissions reduction targets and track progress using verified data held by the CER.",,,Sustainaility_Data_Pack,14,,,"Corporate Emissions Reduction Transparency (CERT), Clean Energy Regulator, Emissions Reduction",13,E,,,,,,,,,,,,,,,,
