Unnamed: 0,Industry,GRI Code,GRI Name,Disclosure,Disclosure Name,General Information,Initiative,Initiative from the undisclosed GRI (found by the coder but not mentioned in the GRI index table),UNDISCLOSED GRI,Organisation,Year,Solution Description,Solution Outcome,Digital tool,Data Source,Unnamed: 15,Unnamed: 16,Unnamed: 17,Keywords,SDGs,ESG,UNGC,Notes,Unnamed: 23,Unnamed: 24,Unnamed: 25,Unnamed: 26,Unnamed: 27,Unnamed: 28,Unnamed: 29,Unnamed: 30,Unnamed: 31,Unnamed: 32,Unnamed: 33,Unnamed: 34,Unnamed: 35,Unnamed: 36
72,,203.0,Indirect Economic Impacts,203-02,Significant indirect economic impacts,,Robotic Mining,,,Newcrest,2023.0,"Fully developed autonomous production system at Cadia, including support functions capable of 24/7 production across a panel cave. Reduces hazard exposure rates of manual operators on the production level with application to other sites.",,,2023 ESG DataBook_0 - GRI Content Index,33,,,"Autonomous Production System, Panel Cave, Hazard Exposure Rates",8.0,G,,Sustainability Report - 2023,,,,,,,,,,,,,,
73,,203.0,Indirect Economic Impacts,203-02,Significant indirect economic impacts,,Selective Processing,,,Newcrest,2023.0,"Ore sorting trials at Brucejack commenced following impressive positive preliminary results. Concept study now complete and detailed design on a trial installation and procurement of long-lead items well advanced. Selective oxidation at Lihir is currently being used, allowing for higher sulphur ore feeds, enabling bottleneck rates, lower energy transition in kWh/t and lower unit costs.",,,2023 ESG DataBook_0 - GRI Content Index,33,,,"Ore Sorting, BruceJack, Lower Unit Costs",8.0,G,,Sustainability Report - 2023,,,,,,,,,,,,,,
74,,203.0,Indirect Economic Impacts,203-02,Significant indirect economic impacts,,SmartHog Underground Inspection,,,Newcrest,2023.0,"Three graduates are advancing the way we work underground at Cadia. Taking on the challenge to remove personnel from significant hazards, Aaron Gilbert, Logan Torrance and Finn Wedge created a robotic inspection platform custom-made for the fully autonomous PC1 extraction level. Together with help from graduate mentor and Senior Project Engineer Tom Corbett and Technology and Innovation Manager Jason Nitz, the trio built the SmartHog fromÂ scratch, from the design and construction of the mechanical and electrical systems to writing the computer code and implementing customised radar technology adapted from the automotive industry to control the machine and manage the outputs it produces.",,,2023 ESG DataBook_0 - GRI Content Index,34,,,"Three Graduates, Major Hazards, Graduate Mentor, and Senior Project Engineer",8.0,G,,Sustainability Report - 2023,,,,,,,,,,,,,,
75,,204.0,Procurement Practices,204-01,Proportion of spending on local suppliers,"The total in the country of Goods and Supplies purchased locally consisted of near mine/local government area, state/province, and land was 65%. Meanwhile, the total services purchased locally consisted of near mine/local government area, state/province, and country 84%.",,,,Newcrest,2023.0,,,,2023 ESG DataBook_0 - GRI Content Index,43,,,,,,,Sustainability Report - 2023,,,,,,,,,,,,,,
76,,205.0,Anti-corruption,205-01,Operations assessed for risks related to corruption,"Ten out of 10 (100%) of operations were assessed for organisational risks related to corruption during the reporting period. The following operations were set in FY23: Americas, Brucejack, Cadia, Exploration, Namosi/Fiji, Havieron, Lihir, Port Moresby, Red Chris, Telfer and Wafi-Golpu. \n\nIn line with Ethics & Compliance's assurance program, which includes the biannual E&C Review Sessions, each operation's E&C risks (e.g. conflicts of interest, bribery and corruption, training compliance, E&C compliance risks and controls, monitoring and review activities, issues management, and gifts, hospitality and sponsored travel) were reviewed with the assistance of each operation's E&C Champion(s). Whilst compliance controls were noted to require further strengthening in a few operations' key E&C risk areas, these were known and were being addressed. During the FY23 review period, no significant or material corruption issues were identified in our operations.",,,,Newcrest,2023.0,,,,2023 ESG DataBook_0 - GRI Content Index,2023 ESG DataBook_0 - GRI Content Index,,,,,,,Sustainability Report - 2023,,,,,,,,,,,,,,
77,,205.0,Anti-corruption,205-02,Communication and training about anti-corruption policies and procedures,,Stop Think and Ask,,,Newcrest,2023.0,"In FY23, we developed new Ethics and compliance courses to be rolled out and completed by high-risk roles across the business in FY24 about our Code of Conduct, Anti-Bribery and corruption, Fraud, Conflicts of Interest, Privacy, and our Speak Out program. This Newcrest-centric training provides advice relevant to our jurisdictions, includes âstop, think and askâ moments, knowledge checks and activities based on investigation lessons, and builds on previously implemented training.",,,2023 ESG DataBook_0 - GRI Content Index,35,,,"High-Risk Roles, Anti-Bribery & Corruption, Fraud, Conflict of interest\t",8.0,G,,Sustainability Report - 2023,,,,,,,,,,,,,,
78,,205.0,Anti-corruption,205-03,Confirmed incidents of corruption and actions taken,"In Cadia, there is a partially substantiated - Conflict of Interest whereby a contract provider allegedly assigns accommodation, and individuals within the company benefit financially from these arrangements. In Lihir, 1. Substantiated - 18 persons identified with fraudulent Electrical Licences and persons still on-site at the time of the findings were removed, with a permanent ban on their profile. 2. Substantiated - The contractor intentionally gave non-company personnel their boarding pass under their identity in an attempt to board a flight. 3. Substantiated - The contractor fraudulently obtained a Police Clearance Certificate through a 3rd party in Port Moresby.Â In Red Chris, Substantiated - an ex-employee used a Newcrest flight booking for personal use that had not been cancelled after the employee left the company.",,,,Newcrest,2023.0,,,,2023 ESG DataBook_0 - GRI Content Index,2023 ESG DataBook_0 - GRI 200 - Economic tab,,,,,,,Sustainability Report - 2023,,,,,,,,,,,,,,
79,,206.0,Anti-competitive Behavior,206-01,"Legal actions for anti-competitive behavior, anti-trust, and monopoly practices","0 legal actions for anti-competitive behaviour, anti-trust and monopoly practices to report in FY23.",,,,Newcrest,2023.0,,,,2023 ESG DataBook_0 - GRI Content Index,,,,,,,,Sustainability Report - 2023,,,,,,,,,,,,,,
80,,207.0,Tax,207-01,Approach to tax,The ICMM has made a collective commitment for members to disclose the requirements of GRI 207 by 2025. Newcrest intends to adopt GRI 207 in line with the ICMM collective commitment by 2025 and is currently preparing its internal systems and processes.,,,,Newcrest,2023.0,,,,2023 ESG DataBook_0 - GRI Content Index,,,,,,,,Sustainability Report - 2023,,,,,,,,,,,,,,
81,,207.0,Tax,207-02,"Tax governance, control, and risk management",The ICMM has made a collective commitment for members to disclose the requirements of GRI 207 by 2025. Newcrest intends to adopt GRI 207 in line with the ICMM collective commitment by 2025 and is currently preparing its internal systems and processes.,,,,Newcrest,2023.0,,,,2023 ESG DataBook_0 - GRI Content Index,,,,,,,,Sustainability Report - 2023,,,,,,,,,,,,,,
82,,207.0,Tax,207-03,Stakeholder engagement and management of concerns related to tax,The ICMM has made a collective commitment for members to disclose the requirements of GRI 207 by 2025. Newcrest intends to adopt GRI 207 in line with the ICMM collective commitment by 2025 and is currently preparing its internal systems and processes.,,,,Newcrest,2023.0,,,,2023 ESG DataBook_0 - GRI Content Index,,,,,,,,Sustainability Report - 2023,,,,,,,,,,,,,,
83,,207.0,Tax,207-04,Country-by-country reporting,The ICMM has made a collective commitment for members to disclose the requirements of GRI 207 by 2025. Newcrest intends to adopt GRI 207 in line with the ICMM collective commitment by 2025 and is currently preparing its internal systems and processes.,,,,Newcrest,2023.0,,,,2023 ESG DataBook_0 - GRI Content Index,,,,,,,,Sustainability Report - 2023,,,,,,,,,,,,,,
84,,301.0,Materials,301-01,Materials used by weight or volume,,,,NO DISCLOSURE,Newcrest,2023.0,,,,2023 ESG DataBook_0 - GRI Content Index,,,,,,,,Sustainability Report - 2023,,,,,,,,,,,,,,
85,,301.0,Materials,301-02,Recycled input materials used,,,,NO DISCLOSURE,Newcrest,2023.0,,,,2023 ESG DataBook_0 - GRI Content Index,,,,,,,,Sustainability Report - 2023,,,,,,,,,,,,,,
86,,301.0,Materials,301-03,Reclaimed products and thei packaging materials,,,,NO DISCLOSURE,Newcrest,2023.0,,,,2023 ESG DataBook_0 - GRI Content Index,,,,,,,,Sustainability Report - 2023,,,,,,,,,,,,,,
87,,302.0,Energy,302-01,Energy consumption within the organization,"The total energy consumption was 27,188,118 GJ in FY23.",,,,Newcrest,2023.0,,,,2023 ESG DataBook_0 - GRI Content Index,44,,,,,,,Sustainability Report - 2023,,,,,,,,,,,,,,
88,,302.0,Energy,302-02,Energy consumption outside of the organization,,,,NO DISCLOSURE,Newcrest,2023.0,,,,2023 ESG DataBook_0 - GRI Content Index,,,,,,,,Sustainability Report - 2023,,,,,,,,,,,,,,
89,,302.0,Energy,302-03,Energy intensity,The total energy intensity by tonnes of ore milled in the company was 394 MJ/t in FY23.,,,,Newcrest,2023.0,,,,2023 ESG DataBook_0 - GRI Content Index,2023 ESG DataBook_0 - GRI 400 series - Social.,,,,,,,Sustainability Report - 2023,,,,,,,,,,,,,,
90,,302.0,Energy,302-04,Reduction of energy consumption,,,,NO DISCLOSURE,Newcrest,2023.0,,,,2023 ESG DataBook_0 - GRI Content Index,,,,,,,,Sustainability Report - 2023,,,,,,,,,,,,,,
91,,302.0,Energy,302-05,Reductions in energy requirements of products and services,,,,NO DISCLOSURE,Newcrest,2023.0,,,,2023 ESG DataBook_0 - GRI Content Index,,,,,,,,Sustainability Report - 2023,,,,,,,,,,,,,,
92,,303.0,Water and Effluents,303-01,Interactions with water as a shared resource,"Respecting the environment is a critical pillar in our sustainability approach. Newcrestâs Environmental Policy is supported by several performance standards that guide Newcrestâs risk-based approach to management of water stewardship, land use and disturbance, biodiversity, waste rock and tailings management, hazardous waste and closure planning.",,,,Newcrest,2023.0,,,,2023 ESG DataBook_0 - GRI Content Index,23,,,,,,,Sustainability Report - 2023,,,,,,,,,,,,,,
93,,303.0,Water and Effluents,303-02,Management of water discharge-related impacts,,Minerals Council of Australia (MCA) Water Accounting,,,Newcrest,2023.0,"We use the Minerals Council of Australia (MCA) Water Accounting Framework to support water reporting for all our operations, complemented by the International Council on Mining and MetalsÂ (ICMM) Water Reporting Guidelines. Water extraction volumes, discharge volumes and quality are monitored by regulatory and internal requirements to mitigate potential impacts and manage risks.",,,2023 ESG DataBook_0 - GRI Content Index,23,,,"Minerals Council of Australia (MCA), Water Accounting, International Council on Mining and Metals (ICMM), Potential Impacts",13.0,E,,Sustainability Report - 2023,,,,,,,,,,,,,,
94,,303.0,Water and Effluents,303-02,Management of water discharge-related impacts,,Water Stewardship Policy,,,Newcrest,2023.0,"Newcrest has developed a water stewardship policy and water stewardship maturity framework to promote a catchment-based approach to the management of water aspects within the specific community and watershed context of each site. We use: â water in process plants for gold and copper production â seawater at Lihir for cooling and tailings dilution â dewatering for access to mine voids â water for dust suppression â water for services in camps, and potable water supplies.",,,2023 ESG DataBook_0 - GRI Content Index,23,,,"Water Stewardship Maturity Framework, Gold and Copper Production, Lihir",13.0,E,,Sustainability Report - 2023,,,,,,,,,,,,,,
95,,303.0,Water and Effluents,303-02,Management of water discharge-related impacts,,Tailings Storage Facilities (TSFs),,,Newcrest,2023.0,"Telfer, Red Chris and Cadia use terrestrial Tailings Storage Facilities (TSFs), while Lihir uses Deep-Sea Tailings Placement (DSTP) in a suitable deep-ocean location. DSTP was also selected as the preferred tailings management option for our Wafi-Golpu project. Brucejack conducts backfilling of tailings underground, complemented by controlled lake deposition under government approvals.",,,2023 ESG DataBook_0 - GRI Content Index,25,,,"Telfer, Red Chris, and Cadia, Tailings Storage Facilities, Wafi-Golpu Project",13.0,E,,Sustainability Report - 2023,,,,,,,,,,,,,,
