Unnamed: 0,Industry,GRI Code,GRI Name,Disclosure,Disclosure Name,General Information,Initiative,Initiative from the undisclosed GRI (found by the coder but not mentioned in the GRI index table),UNDISCLOSED GRI,Organisation,Year,Solution Description,Solution Outcome,Digital tool,Data Source,Unnamed: 15,Unnamed: 16,Unnamed: 17,Keywords,SDGs,ESG,UNGC,Notes,Unnamed: 23,Unnamed: 24,Unnamed: 25,Unnamed: 26,Unnamed: 27,Unnamed: 28,Unnamed: 29,Unnamed: 30,Unnamed: 31,Unnamed: 32,Unnamed: 33,Unnamed: 34,Unnamed: 35,Unnamed: 36
114,,404.0,Training and Education,404-02,Programs for upgrading employee skills and transition assistance programs,,Hatch22,,,Mirvac,2023.0,"Mirvac designed and delivered the Hatch22 program, which upskilled employees on how to apply its award-winning innovation methodology to its projects. The program was designed to cater to all employees â whether they were new to innovation at Mirvac or wanted to refresh their innovation knowledge and skills. Mirvac also created innovation culture training modules to support leaders in developing the right mindset to operate in a challenging environment.",,,GRI index,,25,,"Hatch22, innovation methodology, innovation knowledge","4, 8, 9",S,,,,,,,,,,,,,,,,
115,,404.0,Training and Education,404-03,Percentage of employees receiving regular performance and career development reviews,"In 2023, all Mirvac employees received performance and career development reviews.",,,,Mirvac,2023.0,,,,GRI index,GRI index,,,,,,,,,,,,,,,,,,,,,
116,,405.0,Diversity and Equal Opportunity,405-01,Diversity of governance bodies and employees,,Diversity and Inclusion Policy,,,Mirvac,2023.0,"Mirvac refreshed its Diversity and Inclusion strategy, which builds on its work around gender diversity and flexibility, and expanded its focus on LGBTQ+ and women in construction. Mirvac also continued its focus on mental health, sharpening its focus on major hazards and psychological health and safety.",,,GRI index,,22,,"Diversity and Inclusion Policy, gender diversity, flexibility",10,S,,,,,,,,,,,,,,,,
117,,405.0,Diversity and Equal Opportunity,405-01,Diversity of governance bodies and employees,,Sydney WorldPride,,,Mirvac,2023.0,"Mirvac celebrated equality and inclusiveness by supporting Sydney WorldPride and the Sydney Gay and Lesbian Mardi Gras in FY23. Mirvac also hosted events for its people in each state head office, including launching its first official LGBTQ+ working group, the Mirvac Pride Committee, consisting of LGBTQ+ colleagues and allies. The Committee is sponsored by Mirvac's Chief Digital Officer and is focused on understanding LGBTQ+ issues and developing initiatives that promote awareness.",,,GRI index,,22,,"Sydney WorldPride, equality, inclusiveness",10,S,,,,,,,,,,,,,,,,
118,,405.0,Diversity and Equal Opportunity,405-01,Diversity of governance bodies and employees,,Harmony Week,,,Mirvac,2023.0,Mirvac celebrated Harmony Week in March with special lunch gatherings at its state offices. It allowed people to discuss and celebrate cultural diversity at Mirvac and learn more about each otherâs heritage.,,,GRI index,,22,,"Harmony Week, lunch gathering, cultural diversity",10,S,,,,,,,,,,,,,,,,
119,,405.0,Diversity and Equal Opportunity,405-02,Ratio of basic salary and remuneration of women to men,Mirvac had no pay gap in 2023.,,,,Mirvac,2023.0,,,,GRI index,ESG analyst toolkit,,,,,,,,,,,,,,,,,,,,,
120,,406.0,Non-discrimination,406-01,Incidents of discrimination and corrective actions taken,,,,NO DISCLOSURE,Mirvac,2023.0,,,,,,,,,,,,,,,,,,,,,,,,,,
121,,407.0,Freedom of Association and Collective Bargaining,407-01,Operations and suppliers in which the right to freedom of association and collective bargaining may be at risk,,,,NO DISCLOSURE,Mirvac,2023.0,,,,,,,,,,,,,,,,,,,,,,,,,,
122,,408.0,Child Labor,408-01,Operations and suppliers at significant risk for incidents of child labor,,,,NO DISCLOSURE,Mirvac,2023.0,,,,,,,,,,,,,,,,,,,,,,,,,,
123,,409.0,Forced or Compulsory Labor,409-01,Operations and suppliers ar significant risk for incidents of forced or compulsory labor,,Vendor Code of Conduct,,,Mirvac,2023.0,"Effective management of an offshore team is critical to Mirvac. This keeps operations running smoothly and ensures that Mirvac's partnerâs employment and working practices adhere to its Vendor Code of Conduct (VCoC) and other policies, including specific consideration of modern slavery risks. On a day-to-day basis, Mirvacâs Sydney-based management team works with the Manila team to manage operational requirements, issues and query resolution.",,,GRI index,,,,"Vendor Code of Conduct, partner employment, working practice","8, 16","S, G",,Modern Slavery Statement page 8,,,,,,,,,,,,,,
124,,409.0,Forced or Compulsory Labor,409-01,Operations and suppliers ar significant risk for incidents of forced or compulsory labor,,Modern slavery risk assessment,,,Mirvac,2023.0,"This year, Mirvac integrated modern slavery risk assessment into its procurement process, enabling automatic consideration for anyone purchasing goods and services at Mirvac. Mirvac's company-wide intranet, the Vine, now includes a link to Mirvacâs detailed risk rating table and Walkfreeâs analysis of modern slavery risk according to geographic area.",,,GRI index,,,,"Modern slavery risk assessment, procurement process, Vine","8, 16","S, G",,Modern Slavery Statement page 12,,,,,,,,,,,,,,
125,,409.0,Forced or Compulsory Labor,409-01,Operations and suppliers ar significant risk for incidents of forced or compulsory labor,,Supply Chain Assurance,,,Mirvac,2023.0,"Supply Chain Assurance is built into Mirvacâs subcontractor tendering process. Through this process, Mirvac asks subcontractors to declare the details of their subcontractors, suppliers and manufacturers â including name, location, and contact person responsible for supply chain assurance. This additional tendering process step enables Mirvac to increase its understanding of its extended supply chain.",,,GRI index,,,,"Supply Chain Assurance, tendering process, subcontractor","8, 16","S, G",,Modern Slavery Statement page 12,,,,,,,,,,,,,,
126,,409.0,Forced or Compulsory Labor,409-01,Operations and suppliers ar significant risk for incidents of forced or compulsory labor,,Modern slavery research,,,Mirvac,2023.0,"In FY23, Mirvac participated in a PCA-led research project investigating modern slavery risk management and reporting in Australiaâs construction industry â specifically, the risk associated with landscaping labour and stone provision. Four other property and construction leaders are working alongside Mirvac on this project: a research team from the University of Melbourne, Willamette University (Oregon, USA) and sustainability advisory Better Sydney.",,,GRI index,,,,"Research project, modern slavery, construction leader","8, 16","S, G",,Modern Slavery Statement page 12,,,,,,,,,,,,,,
127,,409.0,Forced or Compulsory Labor,409-01,Operations and suppliers ar significant risk for incidents of forced or compulsory labor,,Supplier self-assessment,,,Mirvac,2023.0,"Mirvac has continued to collaborate with its peers as a member of the PCA Modern Slavery Working Group. It includes evolving the PCA online supplier self-assessment to help the industry identify and mitigate modern slavery risk. Through this self-assessment, suppliers answer questions outlining their understanding of human rights and modern slavery and their actions to assess and address these issues.",,,GRI index,,,,"Supplier self-assessment, PCA, modern slavery risk","8, 16","S, G",,Modern Slavery Statement page 19,,,,,,,,,,,,,,
128,,409.0,Forced or Compulsory Labor,409-01,Operations and suppliers ar significant risk for incidents of forced or compulsory labor,,Modern slavery questionnaire,,,Mirvac,2023.0,"Mirvac refreshed the modern slavery questionnaires, which are embedded into its vendor onboarding and tendering processes. It ensured that the questions Mirvac's vendors asked remained fresh and relevant, reflecting its evolving understanding of where modern slavery risks reside in its supply chain and operations. For example, Questions were customised to reflect risk as required in Mirvac's recent cleaning tender.",,,GRI index,,,,"Modern slavery questionnaire, vendor onboarding, modern slavery risk","8, 16","S, G",,Modern Slavery Statement page 20,,,,,,,,,,,,,,
129,,409.0,Forced or Compulsory Labor,409-01,Operations and suppliers ar significant risk for incidents of forced or compulsory labor,,Group Procurement Policy and Guideline,,,Mirvac,2023.0,"The Group Procurement Policy and Guideline outline Mirvacâs standards for all procurement activity and promote consistent practices across the Group. Together, the Procurement Policy and Guidelines outline Mirvacâs procurement philosophy, in which Mirvac supports the Ten Principles of the United Nations Global Compact (including ILO relevant responsible sourcing requirements), as well as incorporating the assessment of potential modern slavery risks and the actions taken to assess and address this risk.",,,GRI index,,,,"Group Procurement Policy and Guideline, procurement activity, modern slavery risk","8, 16","S, G",,Modern Slavery Statement page 27,,,,,,,,,,,,,,
130,,410.0,Security Practices,410-01,Security personnel trained in human rights policies or procedures,,,,NO DISCLOSURE,Mirvac,2023.0,,,,,,,,,,,,,,,,,,,,,,,,,,
131,,410.0,Security Practices,410-01,Security personnel trained in human rights policies or procedures,,,Modern slavery training,,Mirvac,2023.0,"Modern slavery training is a component of Mirvac's Licence to Operate (LTO): Group Compliance Annual Training, which all employees must complete as part of their induction process and annually after that. The modern slavery module includes a presentation video created by the Supply Chain Sustainability School and a quiz.",,,,,,,"Modern slavery training, LTO, induction process","8, 16","S, G",,Modern Slavery Statement page 20,,,,,,,,,,,,,,
132,,411.0,Rights of Indigenous Peoples,411-01,Incidents of violations involving rights of indigenous peoples,,,,NO DISCLOSURE,Mirvac,2023.0,,,,,,,,,,,,,,,,,,,,,,,,,,
133,,412.0,Human Rights Assessment,412-01,Operations that have been subject to human rights reviews or impacts assessments,,,,NO DISCLOSURE,Mirvac,2023.0,,,,,,,,,,,,,,,,,,,,,,,,,,
134,,412.0,Human Rights Assessment,412-02,Employee training on human rights policies or procedures,,,,NO DISCLOSURE,Mirvac,2023.0,,,,,,,,,,,,,,,,,,,,,,,,,,
135,,412.0,Human Rights Assessment,412-03,Significant investment agreements and contracts that include human rights clauses or that underwent human rights screening,,,,NO DISCLOSURE,Mirvac,2023.0,,,,,,,,,,,,,,,,,,,,,,,,,,
136,,413.0,Local Communities,413-01,"Operations with local community engagement, impact assessments, and development programs",,,,NO DISCLOSURE,Mirvac,2023.0,,,,,,,,,,,,,,,,,,,,,,,,,,
137,,413.0,Local Communities,413-02,Operations with significant actual and potential negative impacts on local communities,,,,NO DISCLOSURE,Mirvac,2023.0,,,,,,,,,,,,,,,,,,,,,,,,,,
138,,414.0,Supplier Social Assessment,414-01,New suppliers that were screened using social criteria,,,,NO DISCLOSURE,Mirvac,2023.0,,,,,,,,,,,,,,,,,,,,,,,,,,
139,,414.0,Supplier Social Assessment,414-02,Negative social impacts in the supply chain and actions taken,,,,NO DISCLOSURE,Mirvac,2023.0,,,,,,,,,,,,,,,,,,,,,,,,,,
140,,415.0,Public Policy,415-01,Political contributions,,Government Relations Policy,,,Mirvac,2023.0,"In FY23, the Board approved an updated Government Relations Policy to protect and enhance Mirvacâs brand and corporate reputation, satisfy regulatory requirements, deliver on its ESG commitments, and minimise adverse stakeholder outcomes.",,,GRI index,,27,,"Government Relations Policy, corporate reputation, regulatory requirement",16,G,,,,,,,,,,,,,,,,
141,,416.0,Customer Health and Safety,416-01,Assessment of the health and safety impacts of product and service categories,,,,NO DISCLOSURE,Mirvac,2023.0,,,,,,,,,,,,,,,,,,,,,,,,,,
142,,416.0,Customer Health and Safety,416-01,Assessment of the health and safety impacts of product and service categories,,,Red List Free Certification,,Mirvac,2023.0,"All GH Commercial wool carpets sourced for Mirvacâs Willoughby project have obtained DeclareÂ® LBC Red List Free Certification to provide greater transparency to deliver clear, unambiguous information about the ingredients used in their products. Further, GH Commercialâs wool broadloom products have achieved the Environmental Certification Scheme (ECS) and Australian Carpet Classification Scheme (ACCS) gradings through the Carpet Institute of Australia and are all PVC-free.",,,,,,,"Red List Free Certification, wool carpet, wool broadloom",12,E,,Modern Slavery Statement page 12,,,,,,,,,,,,,,
143,,416.0,Customer Health and Safety,416-02,Incidents of non-compliance concerning the health and safety impacts of products and services,,,,NO DISCLOSURE,Mirvac,2023.0,,,,,,,,,,,,,,,,,,,,,,,,,,
144,,417.0,Marketing and Labeling,417-01,Requirements for product and service information and labeling,,,,NO DISCLOSURE,Mirvac,2023.0,,,,,,,,,,,,,,,,,,,,,,,,,,
145,,417.0,Marketing and Labeling,417-02,Incidents of non-compliance concerning product and service information and labeling,,,,NO DISCLOSURE,Mirvac,2023.0,,,,,,,,,,,,,,,,,,,,,,,,,,
146,,417.0,Marketing and Labeling,417-03,Incidents of non-compliance concerning marketing communications,,,,NO DISCLOSURE,Mirvac,2023.0,,,,,,,,,,,,,,,,,,,,,,,,,,
147,,418.0,Customer Privacy,418-01,Substantiated complaints concerning breaches of customer privacy and losses of customer data,,,,NO DISCLOSURE,Mirvac,2023.0,,,,,,,,,,,,,,,,,,,,,,,,,,
148,,419.0,Socioeconomic Compliance,419-01,Non-compliance with laws and regulations in the social and economical area,,,,NO DISCLOSURE,Mirvac,2023.0,,,,,,,,,,,,,,,,,,,,,,,,,,
151,,,Total disclosure,72,,,,,,,,,,,,,,,,,,,,,,,,,,,,,,,,,
152,,,Total no of reported disclosure over maximum disclosure (source:GRI index),72/122,,,,,,,,,,,,,,,,,,,,,,,,,,,,,,,,,
153,,,Average completion rate,0.590164,,,,,,,,,,,,,,,,,,,,,,,,,,,,,,,,,
