Unnamed: 0,Unnamed: 0.1,Unnamed: 1,Unnamed: 2,Unnamed: 3,Unnamed: 4,Unnamed: 5,Unnamed: 6,Unnamed: 7,Unnamed: 8,Unnamed: 9,Unnamed: 10,Unnamed: 11,Unnamed: 12,Unnamed: 13,Unnamed: 14,Unnamed: 15,Unnamed: 16,Unnamed: 17
1,,,"About this Index: The Principles for Sustainable Insurance (PSI) are a framework for the global insurance industry to address environmental, social and governance risks and opportunities. QBE has been a signatory to the PSI since 2015 and the Principles inform the approach we take to embedding sustainability considerations into our business decision-making. As signatories to the PSI, we are required to make an annual disclosure outlining our progress in implementing the Principles (this document). This year we are reporting via an index to the relevant disclosures that correspond to the principles, primarily within our 2023 Sustainability Report or website.",,,,,,,,,,,,,,,
3,,,The UNEP FI Principles for Sustainable Insurance,How QBE is progressing on the possible actions within each Principle,,,,,,,,,,,,,,
6,,,"Principle 1\nWe will embed in our decision-making environmental, social and governance issues relevant to our insurance business.",â¢,Company strategy: Sustainability governance framework,,,,,,,,,,,,,
7,,,,â¢,Company strategy: Annual Report - Sustainability (Page 7),,,,,,,,,,,,,
8,,,,â¢,Company Strategy: Sustainability Report - Our approach to sustainability (Page 3),,,,,,,,,,,,,
9,,,,â¢,Risk management and underwriting: Annual Report - Climate-related financial disclosures (pages 20-33),,,,,,,,,,,,,
10,,,,â¢,Risk management and underwriting: Annual Report - Risk Management (pages 16- 19),,,,,,,,,,,,,
11,,,,â¢,"Product and service development: Sustainability Report - Our underwriting approach towards a net-zero economy (page 5), Responsible products and services (page 20)",,,,,,,,,,,,,
12,,,,â¢,"Product and service development: Sustainability Report - Equity, poverty and financial inclusion (page 19)",,,,,,,,,,,,,
13,,,,â¢,Product and service development: Financial Inclusion Action Plan (FIAP),,,,,,,,,,,,,
14,,,,â¢,Product and service development: Technology offered to agriculture customers in North America,,,,,,,,,,,,,
15,,,,â¢,Investment management: Impact & Responsible Investments,,,,,,,,,,,,,
16,,,,â¢,"Investment management: Sustainability Report - Impact & Responsible Investments (page 6), Premiums4Good (Page 21)",,,,,,,,,,,,,
18,,,"Principle 2\nWe will work together with our clients and business partners to raise awareness of environmental, social and governance issues, manage risk and develop solutions.",â¢,Clients and suppliers: Supplier Sustainability Principles (to be replaced with Supplier Code of Responsible Conduct in 2024),,,,,,,,,,,,,
19,,,,â¢,"Clients and suppliers: Sustainability Report - Third Party Risk Management and Supplier Engagement (page 23), Sustainable procurement (page 24)",,,,,,,,,,,,,
20,,,,â¢,Clients and suppliers: Refer to Modern Slavery Risk & Compliance Standard,,,,,,,,,,,,,
21,,,,â¢,Clients: Sustainability Report - Our Underwriting approach towards a net-zero economy (Page 5),,,,,,,,,,,,,
22,,,,â¢,Clients: Working with Customers - Premiums4Good,,,,,,,,,,,,,
24,,,"Principle 3\nWe will work together with governments, regulators and other key stakeholders to promote widespread action across society on environmental, social and governance issues.",â¢,"Governments, regulators and other policymakers: Working with a number of industry bodies on sustainability related topics",,,,,,,,,,,,,
25,,,,â¢,"Governments, regulators and other policymakers: Sustainability Report - Natural disaster resilience (page 17), Sustainable and responsible policies, positions and advocacy (page 22)",,,,,,,,,,,,,
27,,,Principle 4\nWe will demonstrate accountability and transparency in regularly disclosing publicly our progress in implementing the Principles.,â¢,"We have disclosed our progress in implementing the Principles annually since 2015. Our accountability to the Principles for Sustainable Insurance are demonstrated in the public sustainability commitments and initiatives we undertake as discussed our annual Sustainability Report and, where appropriate, elsewhere in QBEâs annual reporting suite. Our 2023 Sustainability Report publishes a prospective scorecard for 2023 to 2025. Our progress against our 2023 scorecard is reported in our data book with links to our 2023 Sustainability Report for relevant details. Our 2023 annual report includes our climate-risk related disclosures. Disclosures associated with our commitments through the NZ AOA and NZIA will follow the associated protocols.",,,,,,,,,,,,,
