Unnamed: 0,Industry,GRI Code,GRI Name,Disclosure,Disclosure Name,General Information,Initiative,Initiative from the undisclosed GRI (found by the coder but not mentioned in the GRI index table),UNDISCLOSED GRI,Organisation,Year,Solution Description,Solution Outcome,Digital tool,Data Source,Unnamed: 15,Unnamed: 16,Unnamed: 17,Keywords,SDGs,ESG,UNGC,Notes,Unnamed: 23,Unnamed: 24,Unnamed: 25,Unnamed: 26,Unnamed: 27,Unnamed: 28,Unnamed: 29,Unnamed: 30,Unnamed: 31,Unnamed: 32,Unnamed: 33,Unnamed: 34,Unnamed: 35,Unnamed: 36
140,,403.0,Occupational Health and Safety,403-06,Promotion of worker health,"When people are provided with the necessary tools, they have access to the required resources, equipment, information, and support to ensure their safety and wellbeing in the workplace. This concept encompasses tangible and intangible assets that empower individuals to identify, address, and mitigate safety hazards effectively.",,,,Auckland International Airport,2023.0,,,,,,74,,,,,,,,,,,,,,,,,,,,
141,,403.0,Occupational Health and Safety,403-07,Prevention and mitigation of occupational health and safety impacts directly linked by business relationships,,Crisis Management Team (CMT),,,Auckland International Airport,2023.0,"The company has a Crisis Management Team (CMT), comprised of leadership team members and senior employees from across the business, which has an established governance structure to manage fast-evolving risk situations robustly and practically. The CMT makes strategic decisions, business responses, emergency communications, staff health and welfare, and government relations decisions.",,,,,75,,"Crisis, Management, Team",3.8,S,,,,,,,,,,,,,,,,
142,,403.0,Occupational Health and Safety,403-08,Workers covered by an occupational health and safety management system,,Safety policy statement,,,Auckland International Airport,2023.0,"A safety policy statement is a formal declaration or document issued by an organization to outline its commitment, objectives, and principles regarding safety in the workplace. It communicates the organization's dedication to creating and maintaining a safe and healthy work environment for its employees, contractors, visitors, and other stakeholders.",,,,,74,,"HSE, Safety, Policy",3.8,S,,,,,,,,,,,,,,,,
143,,403.0,Occupational Health and Safety,403-09,Work-related injuries,,,,NO DISCLOSURE,Auckland International Airport,2023.0,,,,,,,,,,,,,,,,,,,,,,,,,,
144,,403.0,Occupational Health and Safety,403-10,Work-related ill health,,,,NO DISCLOSURE,Auckland International Airport,2023.0,,,,,,,,,,,,,,,,,,,,,,,,,,
145,,404.0,Training and Education,404-01,Average hours of training per year per employee,,,,NO DISCLOSURE,Auckland International Airport,2023.0,,,,,,,,,,,,,,,,,,,,,,,,,,
146,,404.0,Training and Education,404-02,Programs for upgrading employee skills and transition assistance programs,,Future Director Program,,,Auckland International Airport,2023.0,The Board is committed to supporting the next generation in governance in New Zealand as part of the Future Director Programme administered by the New Zealand Institute of Directors. The appointment of Sarah brings additional experience to the AIAL Board with areas of high competence in Technology & Digital and Retail skills.,,,,,78,,"Future, Director, Upgrading",4.8,S,,,,,,,,,,,,,,,,
147,,404.0,Training and Education,404-03,Percentage of employees receiving regular performance and career development reviews,"All employees participate in regular performance and development reviews, with end-of-year review outcomes informing decisions regarding remuneration adjustments by company policy.",,,,Auckland International Airport,2023.0,,,,,,86,,,,,,,,,,,,,,,,,,,,
148,,405.0,Diversity and Equal Opportunity,405-01,Diversity of governance bodies and employees,"Auckland Airport has an equal representation of women and men on its Board, with the chairs of three of its committees being women. Another of the company's diversity objectives is attracting and retaining a diverse workforce with 50 nationalities.",,,,Auckland International Airport,2023.0,,,,,,79,,,,,,,,,,,,,,,,,,,,
149,,405.0,Diversity and Equal Opportunity,405-02,Ratio of basic salary and remuneration of women to men,,,,NO DISCLOSURE,Auckland International Airport,2023.0,,,,,,,,,,,,,,,,,,,,,,,,,,
150,,406.0,Non-discrimination,406-01,Incidents of discrimination and corrective actions taken,,,,NO DISCLOSURE,Auckland International Airport,2023.0,,,,,,,,,,,,,,,,,,,,,,,,,,
151,,407.0,Freedom of Association and Collective Bargaining,407-01,Operations and suppliers in which the right to freedom of association and collective bargaining may be at risk,,,,NO DISCLOSURE,Auckland International Airport,2023.0,,,,,,,,,,,,,,,,,,,,,,,,,,
152,,408.0,Child Labor,408-01,Operations and suppliers at significant risk for incidents of child labor,"Auckland Airport supports the protection of human rights. It is guided by principles such as those in the UN Global Compact, the United Nations Universal Declaration of Human Rights, the UN Convention on the Rights of the Child and the International Labour Organisation (ILO). Auckland Airport ensures that all work is voluntary and will not traffic persons or use any enslaved person, bonded, child labour or prison labour.",,,,Auckland International Airport,2023.0,,,,,,,,,,,,Location from Modern Slavery Company Policy Page 3,,,,,,,,,,,,,,
153,,409.0,Forced or Compulsory Labor,409-01,Operations and suppliers ar significant risk for incidents of forced or compulsory labor,,,,NO DISCLOSURE,Auckland International Airport,2023.0,,,,,,,,,,,,,,,,,,,,,,,,,,
154,,410.0,Security Practices,410-01,Security personnel trained in human rights policies or procedures,,,,NO DISCLOSURE,Auckland International Airport,2023.0,,,,,,,,,,,,,,,,,,,,,,,,,,
155,,411.0,Rights of Indigenous Peoples,411-01,Incidents of violations involving rights of indigenous peoples,,,,NO DISCLOSURE,Auckland International Airport,2023.0,,,,,,,,,,,,,,,,,,,,,,,,,,
156,,412.0,Human Rights Assessment,412-01,Operations that have been subject to human rights reviews or impacts assessments,,Our Just Culture Strategy,,,Auckland International Airport,2023.0,"Our Just Culture Strategy was redesigned to align with our core values and the new application was implemented across the business. It began our journey towards creating an environment of psychological safety with a roadshow to introduce the latest application to the entire organization, which promoted recognition equally when things went well.",,,,,67,,"Psychological, Human rights, Culture",81016.0,S,,,,,,,,,,,,,,,,
157,,412.0,Human Rights Assessment,412-02,Employee training on human rights policies or procedures,,Mental Health awareness session,,,Auckland International Airport,2023.0,"A mental health awareness session is a structured educational program or workshop designed to increase understanding, knowledge, and awareness of mental health issues, promote mental wellbeing, and reduce stigma surrounding mental illness. These sessions provide participants with information, resources, and strategies to recognize, address, and support mental health concerns effectively.",,,,,69,,"Mental health, Awareness, Session",81016.0,S,,,,,,,,,,,,,,,,
158,,412.0,Human Rights Assessment,412-02,Employee training on human rights policies or procedures,,Modern Slavery Training,,,Auckland International Airport,2023.0,"Modern slavery training refers to educational programs, workshops, or courses designed to raise awareness, increase understanding, and provide knowledge about modern slavery, including its causes, manifestations, impacts, and ways to combat it. This type of training is aimed at Auckland to equip them with the information and skills needed to identify, prevent, and respond to instances of modern slavery effectively.",,,,,,,"Modern slavery, Training, Human right",81016.0,S,,Location from Modern Slavery Company Policy Page 1,,,,,,,,,,,,,,
159,,412.0,Human Rights Assessment,412-03,Significant investment agreements and contracts that include human rights clauses or that underwent human rights screening,,,,NO DISCLOSURE,Auckland International Airport,2023.0,,,,,,,,,,,,,,,,,,,,,,,,,,
160,,413.0,Local Communities,413-01,"Operations with local community engagement, impact assessments, and development programs",,Helping hands program,,,Auckland International Airport,2023.0,Auckland values our strong links with the community and will continue to contribute to the wellbeing and growth of local people actively. Auckland International Airport provides 1000 blankets for flood-affected people.,,,,,32,,"Community, Contribution, Helping hands",3.17,S,,,,,,,,,,,,,,,,
161,,413.0,Local Communities,413-01,"Operations with local community engagement, impact assessments, and development programs",,Job fair,,,Auckland International Airport,2023.0,"It's not only about keeping the people Auckland Airport has but attracting new people into roles at the airport. Alongside the tried-and-true methods of finding staff, Auckland Airport hosted a job fair in July 2022 to boost recruitment for roles in our workforce and across the precinct.",,,,,35,,"Recruitment, Job fair, Local people",1.17,S,,,,,,,,,,,,,,,,
162,,413.0,Local Communities,413-01,"Operations with local community engagement, impact assessments, and development programs",,Ara obs and Skills Hub,,,Auckland International Airport,2023.0,"Many people working at Auckland Airport were born and raised in the South. Auckland, attending local schools before entering the workforce. To keep cementing these links, Auckland Airport has partnered with the Ministry of Social Development since 2015 in the on-precinct Ara Jobs and Skills Hub.",,,,,36,,"Support, Education, Local community",4.17,S,,,,,,,,,,,,,,,,
163,,413.0,Local Communities,413-02,Operations with significant actual and potential negative impacts on local communities,,,,NO DISCLOSURE,Auckland International Airport,2023.0,,,,,,,,,,,,,,,,,,,,,,,,,,
164,,414.0,Supplier Social Assessment,414-01,New suppliers that were screened using social criteria,,Supplier code of conduct,,,Auckland International Airport,2023.0,This supplier Code of Conduct details our ambition for all suppliers providing products and services to Auckland Airport. Suppliers are expected to be aware of and comply with this code and all other relevant procedures of Auckland Airport and relevant obligations set out in legislation.,,,,,75,,"Supplier, Procedure, Social",101617.0,S,,,,,,,,,,,,,,,,
165,,414.0,Supplier Social Assessment,414-02,Negative social impacts in the supply chain and actions taken,,Procuring modern slavery software for supplier,,,Auckland International Airport,2023.0,"Procuring modern slavery software for suppliers involves acquiring specialized software tools or platforms designed by Auckland to help identify, assess, monitor, and mitigate the risk of modern slavery within their supply chains. These software solutions typically offer features and functionalities to track and analyze supplier data, assess compliance with anti-slavery regulations, detect potential indicators of forced labour or human trafficking, and manage risk effectively.",,,,,75,,"Supplier, Modern slavery, Software",9101617.0,S,,,,,,,,,,,,,,,,
166,,415.0,Public Policy,415-01,Political contributions,"Political contributions to any Government official, political party, political party official, election committee or political candidate must not be made, whether directly or indirectly, on behalf of Auckland Airport without the prior approval of the Board.",,,,Auckland International Airport,2023.0,,,,,,,,,,,,Location from Ethics and Code of Conduct page 5,,,,,,,,,,,,,,
167,,416.0,Customer Health and Safety,416-01,Assessment of the health and safety impacts of product and service categories,,,,NO DISCLOSURE,Auckland International Airport,2023.0,,,,,,,,,,,,,,,,,,,,,,,,,,
168,,416.0,Customer Health and Safety,416-02,Incidents of non-compliance concerning the health and safety impacts of products and services,,,,NO DISCLOSURE,Auckland International Airport,2023.0,,,,,,,,,,,,,,,,,,,,,,,,,,
169,,417.0,Marketing and Labeling,417-01,Requirements for product and service information and labeling,,,,NO DISCLOSURE,Auckland International Airport,2023.0,,,,,,,,,,,,,,,,,,,,,,,,,,
170,,417.0,Marketing and Labeling,417-02,Incidents of non-compliance concerning product and service information and labeling,,,,NO DISCLOSURE,Auckland International Airport,2023.0,,,,,,,,,,,,,,,,,,,,,,,,,,
171,,417.0,Marketing and Labeling,417-03,Incidents of non-compliance concerning marketing communications,,,,NO DISCLOSURE,Auckland International Airport,2023.0,,,,,,,,,,,,,,,,,,,,,,,,,,
172,,418.0,Customer Privacy,418-01,Substantiated complaints concerning breaches of customer privacy and losses of customer data,,,,NO DISCLOSURE,Auckland International Airport,2023.0,,,,,,,,,,,,,,,,,,,,,,,,,,
173,,419.0,Socioeconomic Compliance,419-01,Non-compliance with laws and regulations in the social and economical area,,,,NO DISCLOSURE,Auckland International Airport,2023.0,,,,,,,,,,,,,,,,,,,,,,,,,,
176,,,Total disclosure,87,,,,,,,,,,,,,,,,,,,,,,,,,,,,,,,,,
