Unnamed: 0,Unnamed: 0.1,Unnamed: 1,Unnamed: 2,Unnamed: 3,Unnamed: 4,Unnamed: 5,Unnamed: 6,Unnamed: 7
3,,UN SDG Performance Summary,,,,,,
4,,UN SDG,Relevance to Transurban,Key FY23 initiatives and highlights,Key FY23 performance metrics (FY18-23 trend/target status),Performance metric comments,,
5,,,Contributing to safer roads and reducing global deaths and injuries from road traffic accidents,"â¢ Underperformed Road Injury Crash Index (RICI) FY23 target. \nâ¢ 91% of travel on our Australian roads and 63% of travel on our US roads deemed to be four-star or better under the International Road Assessment Program (IRAP).1\nâ¢ Transurban's fleet has a five star safety rating.\nâ¢ Our 24x7 control room and incident response team manage incidents and clear them quickly to reduce the risk of secondary incidents.\nâ¢ Our roads are at least twice as safe as like roads, as independently assessed by the Monash University Accident Research Centre (MUARC).\n\nFor more information see the Customer section of our FY23 Corporate Report.",â¢ Road Injury Crash Index (RICI); 4.3 (target â¤ 4.15) \nâ¢ Road user fatalities; 4\nâ¢ Road Safety Action Plan completion rate; 92% (target 75%),"We set ourself an ambitious annual RICI target, lower than previous years. Our performance against RICI continues on a downward trend, despite underperformance in FY23. While we have made good progress on our road safety action plan activities, we have seen many challenges post-pandemic, including an increase in road deaths across the broader network in Australia and North America, which is understood to be related to changes in driver behaviour and travel patterns. We continue to work with Government and Industry to address these challenges.",,
6,,,"We believe diversity in all its forms, including gender diversity, helps our business and our community to perform better","â¢ Workplace Gender Equality Agency (Australia) Employer of Choice Citation 2021â23 (held for 10 consecutive years).\nâ¢ Rated in the top 10 in Australia and top 20 globally for gender equality by Equileap for the last three years. \nâ¢ Ongoing support for community initiatives, for example funding Settlement Services International's Women at the Wheel driver training program for refugee and migrant women to obtain a drivers licence.\nâ¢ Our Voice employee survey showed our diversity and inclusion approach continues to resonate with our people, with 86% of respondents agreeing that Transurban values all types of diversity.\nâ¢ Females Excelling in Engineering and Technology (FEET) mentoring program continues to support women commencing their career in the industry.\n\nFor more information see the Our People section of our FY23 Corporate Report.",â¢ Board diversity2; 70%M/30%F \nâ¢ Executive diversity3; 50%M/50%F \nâ¢ Direct employee diversity4; 55%M/45%F\nâ¢ 60% employees accessing parental leave in FY23 were male,"In FY23, the majority of those who took parental leave across the business were men (60%), a 69% increase since FY19.",,
7,,,Meeting our energy needs mainly from renewable sources is dramatically reducing our direct greenhouse gas emissions,"â¢ US joins Australian assets with renewable energy agreements now in place for all markets. \nâ¢ Significant energy efficiency initiatives progressed, achieving 10 in 10 energy efficiency target ahead of 2030 target.\n\nFor more information see the Community section of our FY23 Corporate Report.",â¢ Proportion of energy purchased from renewables; 80%\nâ¢ Total onsite renewable energy capacity; 231kW\nâ¢ Energy-efficiency savings to date; 13% \n,"Significant increase in renewable energy supply, with the maturing of New South Wales and Queensland power-purchasing agreements and North America now purchasing renewable electricity.",,
8,,,We can help underrepresented groups participate in and benefit from economic growth.,"â¢ Submitted FY22 Modern Slavery Statement (December 2022) and continue to work with suppliers to identify and address how we may cause, contribute or are linked to any negative human rights impacts in our operations or supply chains.\nâ¢ Supported the consultation on the review of the Australian Modern Slavery Act 2018 (Cth), including organising small supplier participation in consultation.\nâ¢ Provided office space at a Sydney city location for not-for-profit Indigenous charity partner, KARI Foundation.5 The location means KARI is now closer to more of its stakeholders. \nâ¢ Completed our second Innovate Reconciliation Action Plan (RAP) and launched our third Innovate RAP (March 2023 - March 2025).6\nâ¢ Continued focus on providing a safe and inclusive workplace for all workers. \nâ¢ Continued membership with Social Traders, an organisation that connects businesses with certified social enterprises.\nâ¢ Continuing shared value partnerships: Ability Works in Victoria, Muru Mittigar in New South Wales and Multicap in Queensland. \nâ¢ Driver training partnerships provided underrepresented groups with the opportunity to obtain a drivers licence by removing barriers. \nâ¢ Supported 5 Salvation Army Employees to undertake a Diploma of Financial Counselling through financial scholarships. \nâ¢ Enhanced Family and Domestic Violence approach, offering uncapped paid leave (above the statutory minimum) for those who need it. \n\nFor more information see the Business Partners and Supplier section in our FY23 Corporate Report.","â¢ Gender pay equity gap; â¤1% since 2018 (like-for-like roles)\nâ¢ Employee recordable injuries; 0 \nâ¢ Contractor Recordable Injury Frequency Rate (RIFR); 2.77 (target â¤ 4) \nâ¢ Second Reconciliation Action Plan (RAP); 100% actions complete\nâ¢ Number of people employed through our shared value partnerships; 106\nâ¢ >$16.5M in social value has been created through our procurement, shared value partnerships and major projects\nâ¢ 410 participants in driver training programs supported by Transurban during FY23 \nâ¢ >$140M Indigenous procurement spend through our operations and projects to date (Australia) across more than 100 suppliers\nâ¢ >USD70M spend in FY23 on disadvantaged business enterprises (DBEs) and small, women and minority owned (SWaM) businesses in the US","Transurbanâs third Innovate RAP builds on the progress made through our previous Reflect and Innovate RAPs. To develop our RAP, we reviewed the strengths and opportunities that came from our last Innovate RAP and identified key areas for Transurban to focus on in order to mature our approach, including the delivery of an employment strategy.\n",,
