Unnamed: 0,Unnamed: 0.1,Unnamed: 1,Unnamed: 2,Unnamed: 3,Unnamed: 4,Unnamed: 5,Unnamed: 6,Unnamed: 7,Unnamed: 8,Unnamed: 9,Unnamed: 10,Unnamed: 11,Unnamed: 12,Unnamed: 13,Unnamed: 14
59,,"6.5 Implement measures to improve energy efficiency and contribute to a low-carbon future, and report the outcomes based on internationally recognised protocols for measuring CO2 equivalent (GHG) emissions.",Â,Â,Â,Â,Â,Â,Â,Â,Â,"In FY21, we set our medium-term target to halve our operational GHG emissions by 2035 from our FY21 baseline. Recognising that we have a critical role to play in contributing to the decarbonisation of the value chain, in partnership with our customers and suppliers, in FY22 we set a new goal of net zero Scope 3 GHG emissions by 2050.\n\nOur goals and targets are delivered through the work described in our Climate Change Action Plan (CCAP) which was published in September 2022 and is a continuation of work that has been underway since 2015. \n\nOur performance is detailed in our 2023 Sustainable Development Report, and our Scope 1, 2 and 3 greenhouse gas emissions and methodology is detailed in our 2023 Sustainability Databook.",2023 Sustainable Development Report - Addressing climate change (page 87-117)\n2023 Sustainability Databook - Emissions methodology tab\n2023 Sustainability Databook - GHG emissions tab\nClimate Change Action Plan (CCAP) at www.south32.net,,
60,,Principle 7: Conservation of Biodiversity,,,,,,,,,,,,,
61,,"7.1 Neither explore nor develop new mines in World Heritage sites, respect legally designated protected areas, and design and operate any new operations or changes to existing operations to be compatible with the value for which such areas were designated.",Â,Â,Â,Â,Â,Â,Â,Â,Â,"As per the ICMM Performance Expectation 7.1, we are committed to avoiding exploring or mining in World Heritage Areas and to respecting legally designated protected areas.",2023 Sustainable Development Report - Biodiversity (page 68-73),,
62,,"7.2 Assess and address risks and impacts to biodiversity and ecosystem services by implementing the mitigation hierarchy, with the ambition of achieving no net loss to biodiversity. Note: The ambition of no net loss applies to new projects and major expansions to existing projects that impact biodiversity and ecosystem services.",Â,Â,Â,Â,Â,Â,Â,Â,Â,"As part of our approach to biodiversity conservation, we are committed to aiming to achieve, at a minimum, no net loss outcomes for all new projects and major expansions to existing projects.\n\nAll required operations have a biodiversity management plan in place. We require all operations to undertake a risk and opportunity screening exercise at least every five years, including not only direct operational aspects but also the pressures on the surrounding bioregions, which could be influenced by factors such as the physical impacts of climate change and changes in land use. \n\nIn FY23 we focused on expanding implementation of the mitigation hierarchy which is intended to achieve our no net loss commitment for all new projects and major expansions of existing projects. \n\nHillside, HMM and Mozal operations partially meet this performance expectation. We continue to build awareness of the mitigation hierarchy and how it applies to the context of our business, coupled with increasing the focus on progressive rehabilitation within the Life of Operation Plan (LoOP).",2023 Sustainable Development Report - Biodiversity (page 68-73),,
63,,Principle 8: Responsible Production,,,,,,,,,,,,,
64,,"8.1 In project design, operation and de-commissioning, implement cost-effective measures for the recovery, re-use or recycling of energy, natural resources, and materials.",Â,Â,Â,Â,Â,Â,Â,Â,Â,"We are committed to reducing waste generated from our operations and managing contamination and other air emissions to minimise any impact on neighbouring communities and the environment. \n\nIn FY23 we completed two circular economy pilot studies at Worsley Alumina and Mozal Aluminium. The site-specific Pilots staged approach included establishing the baseline, quantitative analysis, workshop and site visits to deliver Circularity Roadmaps. Learnings from these pilots will be applied to other parts of our business as we continue to develop our approach to circular economy.","2023 Sustainable Development Report - Waste, contamination and other emissions (page 78-82)",,
65,,8.2 Assess the hazards of the products of mining according to UN Globally Harmonised System of Hazard Classification and Labelling or equivalent relevant regulatory systems and communicate through safety data sheets and labelling as appropriate.,Â,Â,Â,Â,Â,Â,Â,Â,Â,"Our approach to the stewardship of our commodities is based on accepted best practice for their handling, transportation and use. We are guided by ICMM Mining Principle 8 â Responsible Production, and advice from industry bodies and commodity associations relevant to our products. These include the International Manganese Institute, the International Lead Institute, the International Zinc Institute, the International Aluminium Institute, Aluminium Stewardship Initiative, Australian Coal Industry Research Program and most recently the National Alliance for Advanced Transportation Batteries.\n\nThrough our management systems and internal audit processes, we assess, prevent or mitigate potential environmental, health and safety risks to our people and communities. This ensures that the resources we produce are properly managed when in our control and we work with other stakeholders in the supply chain to promote responsible use of our products after they have left our control.\n\nGEMCO moved from 'meets' to 'partially meets' following the revision of their self-assessment in FY23. Communication of the hazards of products to internal stakeholders through safety data sheets for hazardous substances needs to be strengthened to fully meet the requirements of the Performance Expectation.",2023 Sustainable Development Report - Responsible value chain (page 57-61)\nResponsible value chain at www.south32.net,,
66,,Principle 9: Social Performance,,,,,,,,,,,,,
67,,"9.1 Implement inclusive approaches with local communities to identify their development priorities and support activities that contribute to their lasting social and economic wellbeing, in partnership with government, civil society and development agencies, as appropriate.",Â,Â,Â,Â,Â,Â,Â,Â,Â,"We are proud to invest in local communities and aim to contribute to the social, economic, and institutional development of host countries and communities. We design our social investment programs with input from our key stakeholders to reflect their aspirations and needs. This knowledge, combined with other assessments and surveys, informs our decision about investment in communities. \n\nOur social investment is guided by our internal social performance standard, our Code of Business Conduct and the ICMM Mining Principles, particularly Mining Principles: 3 â Human Rights, 9 â Social Performance and 10 â Stakeholder Engagement. There\nare growing expectations about the contribution of resource companies to socio-economic development. Our social investments aim to respond to issues which affect society, with our efforts concentrated in areas where we believe we can have the greatest impact and contribute to sustainable improvement.",2023 Sustainable Development Report - Our societal contribution (page 41-47),,
68,,"9.2 Enable access by local enterprises to procurement and contracting opportunities across the project life-cycle, both directly and by encouraging larger contractors and suppliers, and also by supporting initiatives to enhance economic opportunities for local communities.",Â,Â,Â,Â,Â,Â,Â,Â,Â,"We support the development and growth of small, medium, and micro enterprises (SMMEs), which contribute to the South African economy as it transitions towards fair economic distribution and the alleviation of poverty. We aim to work with an increasing number of Black-owned suppliers and support them to progress beyond the 51 per cent level of Black ownership defined by the South African Broad Based Black Economic Empowerment Codes.\n\nSupporting Aboriginal and Torres Strait Islander businesses is fundamental to achieving our purpose. We engage with Aboriginal and Torres Strait Islander suppliers at different levels of our supply chain, with local sourcing teams explaining to prospective suppliers our procurement processes and how to work with South32. We also work closely with our contractors to facilitate relationships with Aboriginal and Torres Strait Islander suppliers. \n\nDuring FY23, local procurement across our operations increased by US$111 million, comprising 22.6 per cent of non-traded procurement spend. \n\nWe hold local supplier events to highlight opportunities and provide development programs that helps small businesses become procurement ready, increase sales, build competitiveness and enter the value chain of large companies, including South32. This year we continued to provide training to SMMEs to help to meet their needs, relating to financial management, corporate governance, health and safety, human resources and modern slavery.",2023 Sustainable Development Report - Responsible value chain (page 57-61),,
69,,9.3 Conduct stakeholder engagement based upon an analysis of the local context and provide local stakeholders with access to effective mechanisms for seeking resolution of grievances related to the company and its activities.,Â,Â,Â,Â,Â,Â,Â,Â,U,"The support of the communities where we operate is critical to our success. Being transparent and building relationships based on trust is essential to the way we operate. That means being in touch with the broader community, considering different perspectives and working together. \n\nOur internal social performance standard sets the minimum performance requirements for collaborative and transparent engagement with host communities and provides guidance on identifying and managing social impacts and risks associated with our activities. These requirements apply to all operations, functions, projects and greenfields exploration where we have operational control. \n\nWe listen to and report community complaints or grievances we receive, anonymously or otherwise, through our complaints mechanisms and address them as a priority. Our community complaints and grievances processes are aligned with the United Nations Guiding Principles (UNGPs) on Business and Human Rights and the UNâs Protect, Respect and Remedy Framework.",2023 Sustainable Development Report - Partnering with communities (page 35-40),,
70,,"9.4 Collaborate with government, where appropriate, to support improvements in environmental and social practices of local Artisanal and Small-scale Mining (ASM).",U,U,U,U,U,U,U,U,U,South32 does not have artisanal and small-scale mining (ASM) at our operations.,Not applicable,,
71,,Principle 10: Stakeholder Engagement,,,,,,,,,,,,,
72,,10.1 Identify and engage with key corporate-level external stakeholders on sustainable development issues in an open and transparent manner.,U,U,U,U,U,U,U,U,Â,"Respectful relationships with our stakeholders underpin the creation and protection of shared social, economic, and environmental value. The expectations of stakeholders and society more broadly continue to evolve in response to global challenges that affect current and future generations â including climate change, wars and conflict, human rights violations, water scarcity, amongst others. \n\nChallenging ourselves to create social, environmental and economic value is intrinsic to our purpose, aligns with our values and underpins the delivery of our strategy. We work to build positive, meaningful and respectful relationships, guided by the ICMM Mining Principles 9 â Social Performance and 10 â Stakeholder Engagement, as well as our Code of Business Conduct (Code) and internal standards. \n\nIn FY23, our materiality assessment was conducted by an external consultant, and consisted of desktop research, an internal survey sent to 45 of South32âs Senior Leadership Team members, ten interviews with select South32 Board and Lead Team members, and a validation workshop with subject matter experts across various functions at South32.",2023 Sustainable Development Report - Our sustainability approach (page 12-18),,
73,,"10.2 Publicly support the implementation of the Extractive Industries Transparency Initiative (EITI) and compile information on all material payments, at the appropriate levels of government, by country and by project.",Â,Â,Â,Â,Â,Â,Â,Â,Â,"Taxation payments are an important mechanism for contributing to the economies of the countries where we operate. Our approach is aligned with the ICMM Position Statement on Mineral Revenues and the Extractive Industries Transparency Initiative (EITI), which promotes open and accountable management of mineral resource wealth. The EITI has confirmed that South32 meet all the expectations for supporting companies. \n\nWe support the public disclosure of payments made to governments and communities, and the public disclosure by governments on contracts and licences for the exploitation of minerals and other natural resources. \n\nEach year, we publish a Tax Transparency and Payments to Governments Report that shows our tax affairs are conducted in line with our commitment to ethical business practices. This report sets out our approach to tax governance and dealing with tax authorities, details our tax payments to governments by country and project, tax expense and international related party dealings on a country-by-country basis, and our contracts for resource development.",2023 Sustainable Development Report - Our societal contribution (page 41-47)\n2023 Tax Transparency and Payments to Governments report available at www.south32.net,,
74,,"10.3 Report annually on economic, social and environmental performance at the corporate level using the GRI Sustainability Reporting Standards.",U,U,U,U,U,U,U,U,Â,"Our 2023 Sustainable Development Report is prepared in accordance with the Global Reporting Initiative (GRI)\nStandards 2021, Recommendations of the Task Force on Climate-related Financial Disclosures and the ICMM Mining Principles\nand Position Statements.",2023 Sustainable Development Report - Our sustainability approach (page 12-18),,
