Unnamed: 0,Unnamed: 0.1,Unnamed: 1,Unnamed: 2,Unnamed: 3,Unnamed: 4,Unnamed: 5,Unnamed: 6,Unnamed: 7,Unnamed: 8,Unnamed: 9,Unnamed: 10,Unnamed: 11
0,,,,,,Sustainability Databook 2023,,,,,,
3,,ICMM CONFORMANCE PROTOCOLS FOR THE GLOBAL INDUSTRY STANDARD ON TAILINGS MANAGEMENT (GISTM),,,,,,,,,,
5,,"The Conformance Protocols for the Global Industry Standard on Tailings Management (âthe Conformance Protocolsâ) have been developed to support the integration of the Global Industry Standard on Tailings \nManagement (GISTM) into ICMMâs existing assurance and validation processes for its member commitments. The Conformance Protocols support self-assessments and independent third party assessments of progress with implementing the GISTM.\n\nIn accordance with our ICMM member requirements, during FY23 we undertook self-assessments across our facilities with âextremeâ or âvery highâ potential consequences to review conformance with the 77 requirements of the Conformance Protocols. We do not have any 'extreme' potential consequence facilities, with only 'very high' consequence Tailings Storage Facilities (TSFs) at Worsley Alumina's Bauxite Residue Disposal Areas (BRDAs). The outcomes of these self-assessments are detailed below for each of our tailings storage facilities at Worsley Alumina. \n\nOur alignment with the ICMM tailings conformance protocols were part of KPMGâs external assurance scope during FY23. We engaged third parties to undertake technical reviews in addition to our internal review process to assess our technical content against industry standards.",,,,,,,,,,
10,,,Worsley Alumina,,,,,,,,,
11,,ICMM Principle and Conformance Protocol,BRDA 2,BRDA 4,BRDA 4X,BRDA 5,,,,,,
12,,"Principle 1 - Respect the Rights of Project-Affected People and Meaningfully Engage Them at All Phases of the Tailings Facility Lifecycle, Including Closure",,,,,,,,,,
13,,"1.1 Demonstrate respect for human rights in accordance with the United Nations Guiding Principles on Business and Human Rights (UNGP), conduct human rights due diligence to inform management decisions throughout the tailings facility lifecycle and address the human rights risks of tailings facility credible failure scenarios. For existing facilities, the Operator can initially opt to prioritize salient human rights issues in accordance with the UNGP.",Â,Â,Â,Â,,,,,,
14,,"1.2 Where a new tailings facility may impact the rights of indigenous or tribal peoples, including their land and resource rights and their right to self-determination, work to obtain and maintain Free, Prior and Informed Consent (FPIC) by demonstrating conformance to international guidance and recognised best practice frameworks.",Â,Â,Â,Â,,,,,,
15,,1.3 Demonstrate that project-affected people are meaningfully engaged throughout the tailings facility lifecycle in building the knowledge base and in decisions that may have a bearing on public safety and the integrity of the tailings facility. The Operator shall share information to support this process.,Â,Â,Â,Â,,,,,,
16,,"1.4 Establish an effective operational-level, non-judicial grievance mechanism that addresses complaints and grievances of project-affected people relating to the tailings facility, and provides remedy in accordance with the UNGP.",Â,Â,Â,Â,,,,,,
17,,"Principle 2 - Develop and Maintain an Interdisciplinary Knowledge Base to Support Safe Tailings Management Throughout the Tailings Facility Lifecycle, Including Closure",,,,,,,,,,
18,,"2.1 Develop and document knowledge about the social, environmental and local economic context of the tailings facility, using approaches aligned with international best practices. Update this knowledge at least every five years, and whenever there is a material change either to the tailings facility or to the social, environmental and local economic context. This knowledge should capture uncertainties due to climate change.",Â,Â,Â,Â,,,,,,
19,,"2.2 Prepare, document and update a detailed site characterisation of the tailings facility site(s) that includes data on climate, \ngeomorphology, geology, geochemistry, hydrology and hydrogeology (surface and groundwater flow and quality), geotechnical, and seismicity. The physical and chemical properties of the tailings shall be characterised and updated regularly to account for variability in ore properties and processing.",Â,Â,Â,Â,,,,,,
20,,"2.3 Develop and document a breach analysis for the tailings facility using a methodology that considers credible failure modes, site conditions, and the properties of the slurry. The results of the analysis shall estimate the physical area impacted by a potential failure. When flowable materials (water and liquefiable solids) are present at tailings facilities with Consequence Classification of âHighâ, âVery Highâ or âExtremeâ, the results should include estimates of the physical area impacted by a potential failure, flow arrival times, depth and velocities, and depth of material deposition. Update whenever there is a material change either to the tailings facility or the physical area impacted.",Â,Â,Â,Â,,,,,,
21,,"2.4 In order to identify the groups most at risk, refer to the updated tailings facility breach analysis to assess and document potential human exposure and vulnerability to tailings facility credible failure scenarios. Update the assessment whenever there is a material change either to the tailings facility or to the knowledge base.",Â,Â,Â,Â,,,,,,
22,,"Principle 3 - Use All Elements of the Knowledge Base â Social, Environmental, Local Economic and Technical â to Inform Decisions Throughout the Tailings Facility Lifecycle, Including Closure",,,,,,,,,,
23,,"3.1 To enhance resilience to climate change, evaluate, regularly update and use climate change knowledge throughout the tailings facility lifecycle in accordance with the principles of Adaptive Management.",Â,Â,Â,Â,,,,,,
24,,"3.2 For new tailings facilities, the Operator shall use the knowledge base and undertake a multi-criteria alternatives analysis of all feasible sites, technologies and strategies for tailings management. The goal of this analysis shall be to: (i) select an alternative that minimises risks to people and the environment throughout the tailings facility lifecycle; and (ii) minimises the volume of tailings and water placed in external tailings facilities. This analysis shall be an objective constraint analysis reviewed by the Independent Tailings Review Board (ITRB) or a senior independent technical reviewer.\n\nFor existing tailings facilities, the Operator shall periodically review and refine the tailings technologies and design, and management strategies to minimise risk and improve environmental outcomes. An exception applies to facilities that are demonstrated to be in a state of safe closure.",Â,Â,Â,Â,,,,,,
25,,"3.3 For new tailings facilities, use the knowledge base, including uncertainties due to climate change, to assess the social, environmental and local economic impacts of the tailings facility and its potential failure throughout its lifecycle. Where impact assessments predict material acute or chronic impacts, the Operator shall develop, document and implement impact mitigation and management plans using the mitigation hierarchy.",Â,Â,Â,Â,,,,,,
26,,"3.4 Update the assessment of the social, environmental and local economic impacts to reflect a material change either to the tailings facility or to the social, environmental and local economic context. If new data indicates that the impacts from the tailings facility have changed materially, including as a result of climate change knowledge or long-term impacts, the Operator shall update tailings facility management to reflect the new data using Adaptive Management best practices.",Â,Â,Â,Â,,,,,,
27,,"Principle 4 - Develop Plans and Design Criteria for the Tailings Facility to Minimise Risk for All Phases of Its Lifecycle, Including Closure and Post-Closure.",,,,,,,,,,
28,,"4.1 Determine the consequence of failure classification of the tailings facility by assessing the downstream conditions documented in the knowledge base and selecting the classification corresponding to the highest Consequence Classification for each category in Annex 2, Table 1. The assessment and selection of the classification shall be based on credible failure modes, and shall be defensible and documented.",Â,Â,Â,Â,,,,,,
29,,"4.2 With the objective of maintaining flexibility in the development of a new tailings facility and optimising costs while prioritising safety throughout the tailings facility lifecycle:\n\na. Develop preliminary designs for the tailings facility with external loading design criteria consistent with both the consequence of failure classification selected based on current conditions and higher Consequence Classifications (including âExtremeâ).\n\nb. Informed by the range of requirements defined by the preliminary designs, either:\n- Implement the design for the âExtremeâ Consequence Classification external loading criteria; or\n- Implement the design for the current Consequence Classification criteria, or a higher one, and demonstrate that the feasibility, at a proof of concept level, to upgrade to the design for the âExtremeâ classification criteria is maintained throughout the tailings facility lifecycle.\n\nc. If option B.2 is implemented, review the consequence of failure classification at the time of the Dam Safety Review (DSR) and at least every five years, or sooner if there is a material change in the social, environmental and local economic context, and complete the upgrade of the tailings facility to the new Consequence Classification as determined by the DSR within three years. This review shall proceed until the tailings facility has been safely closed according to this Standard.\n\nd. The process described above shall be reviewed by the Independent Tailings Review Board (ITRB) or the senior independent technical reviewer, as appropriate for the tailings facility Consequence Classification.",Â,Â,Â,Â,,,,,,
30,,4.3 The Accountable Executive shall take the decision to adopt a design for the current Consequence Classification criteria and to maintain flexibility to upgrade the design for the highest classification criteria later in the tailings facility lifecycle. This decision shall be documented.,Â,Â,Â,Â,,,,,,
31,,"4.4 Select, explicitly identify and document all design criteria that are appropriate to minimise risk for all credible failure modes for all phases of the tailings facility lifecycle.",Â,Â,Â,Â,,,,,,
32,,"4.5 Apply design criteria, such as factors of safety for slope stability and seepage management that consider estimated operational properties of materials and expected performance of design elements, and quality of the implementation of risk management systems. These issues should also be appropriately accounted for in designs based on deformation analyses.",Â,Â,Â,Â,,,,,,
33,,"4.6 Identify and address brittle failure modes with conservative design criteria, independent of trigger mechanisms, to minimise their impact on the performance of the tailings facility.",Â,Â,Â,Â,,,,,,
34,,"4.7 Existing tailings facilities shall conform with the Requirements under Principle 4, except for those aspects where the Engineer of Record (EOR), with review by the ITRB or a senior independent technical reviewer, determines that the upgrade of an existing tailings facility is not viable or cannot be retroactively applied. In this case, the Accountable Executive shall approve and document the implementation of measures to reduce both the probability and the consequences of a tailings facility failure in order to reduce the risk to a level as low as reasonably practicable (ALARP). The basis and timing for addressing the upgrade of existing tailings facilities shall be risk-informed and carried out as soon as reasonably practicable.",Â,Â,Â,Â,,,,,,
35,,"4.8 The EOR shall prepare a Design Basis Report (DBR) that details the design assumptions and criteria, including operating constraints, and that provides the basis for the design of all phases of the tailings facility lifecycle. The DBR shall be reviewed by the ITRB or senior independent technical reviewer. The EOR shall update the DBR every time there is a material change in the design assumptions, design criteria, design or the knowledge base and confirm internal consistency among these elements.",Â,Â,Â,Â,,,,,,
36,,"Principle 5 - Develop a Robust Design That Integrates the Knowledge Base and Minimises the Risk of Failure to People and the Environment for All Phases of the Tailings Facility Lifecycle, Including Closure and Post-Closure",,,,,,,,,,
37,,"5.1 For new tailings facilities, incorporate the outcome of the multi-criteria alternatives analysis including the use of tailings technologies in the design of the tailings facility.\n\nFor expansions to existing tailings facilities, investigate the potential to refine the tailings technologies and design approaches with the goal of minimising risks to people and the environment throughout the tailings facility lifecycle.",Â,Â,Â,Â,,,,,,
38,,"5.2 Develop a robust design that considers the technical, social, environmental and local economic context, the tailings facility Consequence Classification, site conditions, water management, mine plant operations, tailings operational and construction issues, and that demonstrates the feasibility of safe closure of the tailings facility. The design should be reviewed and updated as performance and site data become available and in response to material changes to the tailings facility or its performance.",Â,Â,Â,Â,,,,,,
