Unnamed: 0,Industry,GRI Code,GRI Name,Disclosure,Disclosure Name,General Information,Initiative,Initiative from the undisclosed GRI (found by the coder but not mentioned in the GRI index table),UNDISCLOSED GRI,Organisation,Year,Solution Description,Solution Outcome,Digital tool,Data Source,Unnamed: 15,Unnamed: 16,Unnamed: 17,Keywords,SDGs,ESG,UNGC,Notes,Unnamed: 23,Unnamed: 24,Unnamed: 25,Unnamed: 26,Unnamed: 27,Unnamed: 28,Unnamed: 29,Unnamed: 30,Unnamed: 31,Unnamed: 32,Unnamed: 33,Unnamed: 34,Unnamed: 35,Unnamed: 36
36,,2.0,General Disclosures,2-30,Collective bargaining agreements,,,,NO DISCLOSURE,Washington H Soul Pattinson Company,2023.0,,,,,,,,,,,,,,,,,,,,,,,,,,
37,,3.0,Material Topics,3-1,Process to determine material topics,"During the current reporting period, MSCI and Standard & Poors updated our Global Industry Classification Standard (GICS) classification from Energy to Financials (sub-industry: diversified financials), reflecting our business and core expertise more accurately.",,,,Washington H Soul Pattinson Company,2023.0,,,,,,66,,,,,,,,,,,,,,,,,,,,
38,,3.0,Material Topics,3-2,List of material topics,"Sustainability in our direct operations, Sustainability in our controlled investments, Sustainability in our substantial investments, Sustainability in our broader portfolio",,,,Washington H Soul Pattinson Company,2023.0,,,,,,"66, 70, 74, 75",,,,,,,,,,,,,,,,,,,,
39,,3.0,Material Topics,3-3,Management of material topics,,Risk management of companies in our broader portfolio approach,,,Washington H Soul Pattinson Company,2023.0,"In our broader investment portfolio, we hold minority holdings in 200+ companies. Our approach to assessing the risk in each investee company focuses on areas considered material to the asset, the industry and related markets, and our portfolio as a whole. Through the combined expertise of our in-house investment team and external advisers, we deeply understand the markets, industries and companies we invest in, including ESG factors, demand and supply dynamics, competitive environment and regulation.",,,,,62,,"Investment Portfolio, Minority Holdings, ESG Factors","8, 9",G,,,,,,,,,,,,,,,,
40,,3.0,Material Topics,3-3,Management of material topics,,International Sustainability Standards Board (ISSB),,,Washington H Soul Pattinson Company,2023.0,"As an Australian investment management business with $10.8 billion in Net Asset Value, WHSPâs goal is to be aligned with the International Sustainability Standards Board (ISSB) standards S1 and S2 on sustainability and climate-related financial disclosure (June 2023) and the emerging Australian Accounting Standards Board (AASB) requirements likely to be in place by FY25. WHSP is currently undergoing a gap analysis to align our future reporting obligations.",,,,,66,,"Sustainability Standards, Climate-related Disclosure, Reporting Alignment",13,E,,,,,,,,,,,,,,,,
41,,201.0,Economic Performance,201-01,Direct economic value generated and distributed,Group Regular NPAT Group Statutory NPAT $ 170m $ 690.7 m,,,,Washington H Soul Pattinson Company,2023.0,,,,,,2,,,,,,,,,,,,,,,,,,,,
42,,201.0,Economic Performance,201-01,Direct economic value generated and distributed,Net Asset Value (pre-tax) $10.8 b,,,,Washington H Soul Pattinson Company,2023.0,,,,,,2,,,,,,,,,,,,,,,,,,,,
43,,201.0,Economic Performance,201-01,Direct economic value generated and distributed,Compound Dividend Growth 9.6 %,,,,Washington H Soul Pattinson Company,2023.0,,,,,,2,,,,,,,,,,,,,,,,,,,,
44,,201.0,Economic Performance,201-02,Financial implications and other risks and opportunities due to climate change,,TCFD framework,,,Washington H Soul Pattinson Company,2023.0,"WHSP closely follows the development of the global and Australian sustainability and climate-related financial disclosure standards. WHSP is adopting the TCFD framework across our direct operations, and we are working on an emissions and sustainability measurement and reporting framework.",,,,,"13, 66",,"TCFD Framework, Emissions Reporting, Employee Engagement","13, 16",E,,,,,,,,,,,,,,,,
45,,201.0,Economic Performance,201-03,Defined benefit plan obligations and other retirement plans,,,,NO DISCLOSURE,Washington H Soul Pattinson Company,2023.0,,,,,,,,,,,,,,,,,,,,,,,,,,
46,,201.0,Economic Performance,201-04,Financial assistance received from government,,,,NO DISCLOSURE,Washington H Soul Pattinson Company,2023.0,,,,,,,,,,,,,,,,,,,,,,,,,,
47,,202.0,Market Presence,202-01,Ratios of standard entry level wage by gender compared to local minimum wage,,,,NO DISCLOSURE,Washington H Soul Pattinson Company,2023.0,,,,,,,,,,,,,,,,,,,,,,,,,,
48,,202.0,Market Presence,202-02,Proportion of senior management hired from the local community,,,,NO DISCLOSURE,Washington H Soul Pattinson Company,2023.0,,,,,,,,,,,,,,,,,,,,,,,,,,
49,,203.0,Indirect Economic Impacts,203-01,Infrastructure investments and services supported,,Developing Technologies to Support the Energy Transition,,,Washington H Soul Pattinson Company,2023.0,"WHSP is attracted to investment opportunities with a competitive advantage in the energy transition, and we recognise that both traditional energy sources and technological innovation are essential for the transition to a lower carbon economy. Ampcontrol is one such example. A leading designer and developer of integrated electrical, electronic and control solutions to improve safety and efficiency in mining, renewable energy generation, infrastructure and industrial applications, it is a participant in the Net Zero Pathways Project (an initiative of the Office of Energy and Climate Change, NSW Treasury) and closely monitors its GHG emissions footprint.",,,,,71,,"Energy Transition, Competitive Advantage, GHG Emissions","7, 9, 13",E,,,,,,,,,,,,,,,,
50,,203.0,Indirect Economic Impacts,203-02,Significant indirect economic impacts,,,,NO DISCLOSURE,Washington H Soul Pattinson Company,2023.0,,,,,,,,,,,,,,,,,,,,,,,,,,
51,,204.0,Procurement Practices,204-01,Proportion of spending on local suppliers,,,,NO DISCLOSURE,Washington H Soul Pattinson Company,2023.0,,,,,,,,,,,,,,,,,,,,,,,,,,
52,,205.0,Anti-corruption,205-01,Operations assessed for risks related to corruption,,Anti-bribery and corruption policy,,,Washington H Soul Pattinson Company,2023.0,"Soul Patts requires all employees to comply with all applicable anti-corruption and anti-bribery laws, irrespective of the employeeâs geographical location or citizenship. Breaches of anti-corruption laws can have severe consequences for both Soul Patts and the employee.",,,,,,,"Anti-corruption Laws, Compliance, Legal Obligations",16,G,,Anti-bribery and corruption policy,,,,,,,,,,,,,,
53,,205.0,Anti-corruption,205-02,Communication and training about anti-corruption policies and procedures,Periodic anti-bribery and corruption risk assessments of Soul Patts's business will be conducted to detect possible misconduct and monitor the compliance program's effectiveness.,,,,Washington H Soul Pattinson Company,2023.0,,,,,,,,,,,,Anti-bribery and corruption policy,,,,,,,,,,,,,,
54,,205.0,Anti-corruption,205-02,Communication and training about anti-corruption policies and procedures,Whistleblower and modern slavery training provided to staff.,,,,Washington H Soul Pattinson Company,2023.0,,,,,,,,,,,,Modern Slavery Statement,,,,,,,,,,,,,,
55,,205.0,Anti-corruption,205-03,Confirmed incidents of corruption and actions taken,,,,NO DISCLOSURE,Washington H Soul Pattinson Company,2023.0,,,,,,,,,,,,,,,,,,,,,,,,,,
56,,206.0,Anti-competitive Behavior,206-01,"Legal actions for anti-competitive behavior, anti-trust, and monopoly practices",,,,NO DISCLOSURE,Washington H Soul Pattinson Company,2023.0,,,,,,,,,,,,,,,,,,,,,,,,,,
57,,207.0,Tax,207-01,Approach to tax,,,,NO DISCLOSURE,Washington H Soul Pattinson Company,2023.0,,,,,,,,,,,,,,,,,,,,,,,,,,
58,,207.0,Tax,207-02,"Tax governance, control, and risk management","The allocation of revenue and expense items between Regular and Non-Regular Net Profit After Tax is consistent with the previous corresponding period. Transactions between business segments are on an arm's length basis, like transactions with third parties.",,,,Washington H Soul Pattinson Company,2023.0,,,,,,30,,,,,,,,,,,,,,,,,,,,
59,,207.0,Tax,207-03,Stakeholder engagement and management of concerns related to tax,,,,NO DISCLOSURE,Washington H Soul Pattinson Company,2023.0,,,,,,,,,,,,,,,,,,,,,,,,,,
60,,207.0,Tax,207-04,Country-by-country reporting,,,,NO DISCLOSURE,Washington H Soul Pattinson Company,2023.0,,,,,,,,,,,,,,,,,,,,,,,,,,
61,,301.0,Materials,301-01,Materials used by weight or volume,,,,NO DISCLOSURE,Washington H Soul Pattinson Company,2023.0,,,,,,,,,,,,,,,,,,,,,,,,,,
62,,301.0,Materials,301-02,Recycled input materials used,,,,NO DISCLOSURE,Washington H Soul Pattinson Company,2023.0,,,,,,,,,,,,,,,,,,,,,,,,,,
63,,301.0,Materials,301-03,Reclaimed products and thei packaging materials,,,,NO DISCLOSURE,Washington H Soul Pattinson Company,2023.0,,,,,,,,,,,,,,,,,,,,,,,,,,
64,,302.0,Energy,302-01,Energy consumption within the organization,,GreenPower,,,Washington H Soul Pattinson Company,2023.0,"We maintain our investment in 50 tonnes of Australian Carbon Credit Units (ACCUs) in the Warrego Carbon Project that is establishing permanent native forests in Queensland and, together with the purchase of GreenPower, have offset all our Scope 1 and Scope 2 emissions for our direct operations in FY23.",,,,,67,,"Carbon Offsetting, Emissions Reduction, Native Forests",13,E,,,,,,,,,,,,,,,,
65,,302.0,Energy,302-01,Energy consumption within the organization,Supporting the energy transition through developing new technologies and innovation and responsibly managing climate-related risks.,,,,Washington H Soul Pattinson Company,2023.0,,,,,,71,,,,,,,,,,,,,,,,,,,,
66,,302.0,Energy,302-02,Energy consumption outside of the organization,,,,NO DISCLOSURE,Washington H Soul Pattinson Company,2023.0,,,,,,,,,,,,,,,,,,,,,,,,,,
67,,302.0,Energy,302-03,Energy intensity,,,,NO DISCLOSURE,Washington H Soul Pattinson Company,2023.0,,,,,,,,,,,,,,,,,,,,,,,,,,
68,,302.0,Energy,302-04,Reduction of energy consumption,,,,NO DISCLOSURE,Washington H Soul Pattinson Company,2023.0,,,,,,,,,,,,,,,,,,,,,,,,,,
69,,302.0,Energy,302-05,Reductions in energy requirements of products and services,,,,NO DISCLOSURE,Washington H Soul Pattinson Company,2023.0,,,,,,,,,,,,,,,,,,,,,,,,,,
70,,303.0,Water and Effluents,303-01,Interactions with water as a shared resource,,,,NO DISCLOSURE,Washington H Soul Pattinson Company,2023.0,,,,,,,,,,,,,,,,,,,,,,,,,,
71,,303.0,Water and Effluents,303-02,Management of water discharge-related impacts,4/6 Star Rating for Water,,,,Washington H Soul Pattinson Company,2023.0,,,,,,67,,,,,,,,,,,,,,,,,,,,
